text,cleaned_text,tokens,stemmed,processed_text
"My son and I snuggled before I laid him down for a nap. While singing to him, we held eye contact and it was a very sweet moment.",my son and i snuggled before i laid him down for a nap while singing to him we held eye contact and it was a very sweet moment,"['son', 'snuggled', 'laid', 'nap', 'singing', 'held', 'eye', 'contact', 'sweet', 'moment']","['son', 'snuggl', 'laid', 'nap', 'sing', 'held', 'eye', 'contact', 'sweet', 'moment']",son snuggl laid nap sing held eye contact sweet moment
Going for a walk with my dog.,going for a walk with my dog,"['going', 'walk', 'dog']","['go', 'walk', 'dog']",go walk dog
"Woke up to see my dog sitting in his bed watching me, waiting for me to wake up.",woke up to see my dog sitting in his bed watching me waiting for me to wake up,"['woke', 'see', 'dog', 'sitting', 'bed', 'watching', 'waiting', 'wake']","['woke', 'see', 'dog', 'sit', 'bed', 'watch', 'wait', 'wake']",woke see dog sit bed watch wait wake
Eating a taco potluck at work with my coworkers today.,eating a taco potluck at work with my coworkers today,"['eating', 'taco', 'potluck', 'work', 'coworkers', 'today']","['eat', 'taco', 'potluck', 'work', 'cowork', 'today']",eat taco potluck work cowork today
"A big surprise, when i was issued a UK visa",a big surprise when i was issued a uk visa,"['big', 'surprise', 'issued', 'uk', 'visa']","['big', 'surpris', 'issu', 'uk', 'visa']",big surpris issu uk visa
The sun was shining bright as I went for my morning run today.,the sun was shining bright as i went for my morning run today,"['sun', 'shining', 'bright', 'went', 'morning', 'run', 'today']","['sun', 'shine', 'bright', 'went', 'morn', 'run', 'today']",sun shine bright went morn run today
I went to the local water park today with my family. We rode water slides together and had a great time.,i went to the local water park today with my family we rode water slides together and had a great time,"['went', 'local', 'water', 'park', 'today', 'family', 'rode', 'water', 'slides', 'together', 'great', 'time']","['went', 'local', 'water', 'park', 'today', 'famili', 'rode', 'water', 'slide', 'togeth', 'great', 'time']",went local water park today famili rode water slide togeth great time
"My parents came to visit me yesterday. We ate dinner together and played cards, much laughter!",my parents came to visit me yesterday we ate dinner together and played cards much laughter,"['parents', 'came', 'visit', 'yesterday', 'ate', 'dinner', 'together', 'played', 'cards', 'much', 'laughter']","['parent', 'came', 'visit', 'yesterday', 'ate', 'dinner', 'togeth', 'play', 'card', 'much', 'laughter']",parent came visit yesterday ate dinner togeth play card much laughter
I was very happy to see my son very excited when he knew that we are travelling abroad this summer.,i was very happy to see my son very excited when he knew that we are travelling abroad this summer,"['happy', 'see', 'son', 'excited', 'knew', 'travelling', 'abroad', 'summer']","['happi', 'see', 'son', 'excit', 'knew', 'travel', 'abroad', 'summer']",happi see son excit knew travel abroad summer
Early Morning time and the sun is warming my skin while I drink coffee.,early morning time and the sun is warming my skin while i drink coffee,"['early', 'morning', 'time', 'sun', 'warming', 'skin', 'drink', 'coffee']","['earli', 'morn', 'time', 'sun', 'warm', 'skin', 'drink', 'coffe']",earli morn time sun warm skin drink coffe
Today I took a short hike in the santa ana mountains. The shade from the trees made the heat much more bearable. The sight was refreshing.,today i took a short hike in the santa ana mountains the shade from the trees made the heat much more bearable the sight was refreshing,"['today', 'took', 'short', 'hike', 'santa', 'ana', 'mountains', 'shade', 'trees', 'made', 'heat', 'much', 'bearable', 'sight', 'refreshing']","['today', 'took', 'short', 'hike', 'santa', 'ana', 'mountain', 'shade', 'tree', 'made', 'heat', 'much', 'bearabl', 'sight', 'refresh']",today took short hike santa ana mountain shade tree made heat much bearabl sight refresh
I won lot of money at casino. I could paid half of my credit and offer my wife a present.,i won lot of money at casino i could paid half of my credit and offer my wife a present,"['lot', 'money', 'casino', 'could', 'paid', 'half', 'credit', 'offer', 'wife', 'present']","['lot', 'money', 'casino', 'could', 'paid', 'half', 'credit', 'offer', 'wife', 'present']",lot money casino could paid half credit offer wife present
Got up and dressed. Walked outside and the weather was warm and the birds were singing.,got up and dressed walked outside and the weather was warm and the birds were singing,"['got', 'dressed', 'walked', 'outside', 'weather', 'warm', 'birds', 'singing']","['got', 'dress', 'walk', 'outsid', 'weather', 'warm', 'bird', 'sing']",got dress walk outsid weather warm bird sing
I had an amazing cup of coffee this morning!,i had an amazing cup of coffee this morning,"['amazing', 'cup', 'coffee', 'morning']","['amaz', 'cup', 'coffe', 'morn']",amaz cup coffe morn
"This morning Joe gave me a warm hug and kiss goodbye. After he left, I realized I could still smell is cologne and it made me smile.",this morning joe gave me a warm hug and kiss goodbye after he left i realized i could still smell is cologne and it made me smile,"['morning', 'joe', 'gave', 'warm', 'hug', 'kiss', 'goodbye', 'left', 'realized', 'could', 'still', 'smell', 'cologne', 'made', 'smile']","['morn', 'joe', 'gave', 'warm', 'hug', 'kiss', 'goodby', 'left', 'realiz', 'could', 'still', 'smell', 'cologn', 'made', 'smile']",morn joe gave warm hug kiss goodby left realiz could still smell cologn made smile
My heart is filled with happiness as my little daughter starts walking today,my heart is filled with happiness as my little daughter starts walking today,"['heart', 'filled', 'happiness', 'little', 'daughter', 'starts', 'walking', 'today']","['heart', 'fill', 'happi', 'littl', 'daughter', 'start', 'walk', 'today']",heart fill happi littl daughter start walk today
"Driving to work in the morning. I feel at ease on the open road, watching the sun slowly make it's way up the skyline. I like to leave early to enjoy moments like this with a bit of solitude on the road.",driving to work in the morning i feel at ease on the open road watching the sun slowly make its way up the skyline i like to leave early to enjoy moments like this with a bit of solitude on the road,"['driving', 'work', 'morning', 'feel', 'ease', 'open', 'road', 'watching', 'sun', 'slowly', 'make', 'way', 'skyline', 'like', 'leave', 'early', 'enjoy', 'moments', 'like', 'bit', 'solitude', 'road']","['drive', 'work', 'morn', 'feel', 'eas', 'open', 'road', 'watch', 'sun', 'slowli', 'make', 'way', 'skylin', 'like', 'leav', 'earli', 'enjoy', 'moment', 'like', 'bit', 'solitud', 'road']",drive work morn feel eas open road watch sun slowli make way skylin like leav earli enjoy moment like bit solitud road
Walking outside my house in the morning going to my job as the suns getting warm,walking outside my house in the morning going to my job as the suns getting warm,"['walking', 'outside', 'house', 'morning', 'going', 'job', 'suns', 'getting', 'warm']","['walk', 'outsid', 'hous', 'morn', 'go', 'job', 'sun', 'get', 'warm']",walk outsid hous morn go job sun get warm
Easy day at work today,easy day at work today,"['easy', 'day', 'work', 'today']","['easi', 'day', 'work', 'today']",easi day work today
When i meet my love in first time.,when i meet my love in first time,"['meet', 'love', 'first', 'time']","['meet', 'love', 'first', 'time']",meet love first time
Had a silly sing-along with my kids in the car this evening. They are so sweet.,had a silly singalong with my kids in the car this evening they are so sweet,"['silly', 'singalong', 'kids', 'car', 'evening', 'sweet']","['silli', 'singalong', 'kid', 'car', 'even', 'sweet']",silli singalong kid car even sweet
"Watched the beautiful sunrise with my dog, sitting just beside me.",watched the beautiful sunrise with my dog sitting just beside me,"['watched', 'beautiful', 'sunrise', 'dog', 'sitting', 'beside']","['watch', 'beauti', 'sunris', 'dog', 'sit', 'besid']",watch beauti sunris dog sit besid
"Lunch with my son today. No TV, cell phones, etc. just wonderful conversation.",lunch with my son today no tv cell phones etc just wonderful conversation,"['lunch', 'son', 'today', 'tv', 'cell', 'phones', 'etc', 'wonderful', 'conversation']","['lunch', 'son', 'today', 'tv', 'cell', 'phone', 'etc', 'wonder', 'convers']",lunch son today tv cell phone etc wonder convers
Waking up to things being clean and tidy,waking up to things being clean and tidy,"['waking', 'things', 'clean', 'tidy']","['wake', 'thing', 'clean', 'tidi']",wake thing clean tidi
I decided to play some Hearthstone today.,i decided to play some hearthstone today,"['decided', 'play', 'hearthstone', 'today']","['decid', 'play', 'hearthston', 'today']",decid play hearthston today
I bought my dream car.,i bought my dream car,"['bought', 'dream', 'car']","['bought', 'dream', 'car']",bought dream car
I got to eat leftover brownie batter yesterday when everyone left.,i got to eat leftover brownie batter yesterday when everyone left,"['got', 'eat', 'leftover', 'brownie', 'batter', 'yesterday', 'everyone', 'left']","['got', 'eat', 'leftov', 'browni', 'batter', 'yesterday', 'everyon', 'left']",got eat leftov browni batter yesterday everyon left
Seeing my dog when I get home and we go for a walk.,seeing my dog when i get home and we go for a walk,"['seeing', 'dog', 'get', 'home', 'go', 'walk']","['see', 'dog', 'get', 'home', 'go', 'walk']",see dog get home go walk
"I went for a walk this morning. I enjoyed the fresh air, flowers, and quiet time to myself.",i went for a walk this morning i enjoyed the fresh air flowers and quiet time to myself,"['went', 'walk', 'morning', 'enjoyed', 'fresh', 'air', 'flowers', 'quiet', 'time']","['went', 'walk', 'morn', 'enjoy', 'fresh', 'air', 'flower', 'quiet', 'time']",went walk morn enjoy fresh air flower quiet time
i was able to do work achievement that was so challenging and needed much preparation,i was able to do work achievement that was so challenging and needed much preparation,"['able', 'work', 'achievement', 'challenging', 'needed', 'much', 'preparation']","['abl', 'work', 'achiev', 'challeng', 'need', 'much', 'prepar']",abl work achiev challeng need much prepar
Hit the gym and hit a new personal best when doing bench press.,hit the gym and hit a new personal best when doing bench press,"['hit', 'gym', 'hit', 'new', 'personal', 'best', 'bench', 'press']","['hit', 'gym', 'hit', 'new', 'person', 'best', 'bench', 'press']",hit gym hit new person best bench press
Cooked myself a wholesome breakfast and drove to work while I watched the sun rise.,cooked myself a wholesome breakfast and drove to work while i watched the sun rise,"['cooked', 'wholesome', 'breakfast', 'drove', 'work', 'watched', 'sun', 'rise']","['cook', 'wholesom', 'breakfast', 'drove', 'work', 'watch', 'sun', 'rise']",cook wholesom breakfast drove work watch sun rise
"I went for my schoolmates get together yesterday evening, enjoyed the happy moments and felt nostalgic.",i went for my schoolmates get together yesterday evening enjoyed the happy moments and felt nostalgic,"['went', 'schoolmates', 'get', 'together', 'yesterday', 'evening', 'enjoyed', 'happy', 'moments', 'felt', 'nostalgic']","['went', 'schoolmat', 'get', 'togeth', 'yesterday', 'even', 'enjoy', 'happi', 'moment', 'felt', 'nostalg']",went schoolmat get togeth yesterday even enjoy happi moment felt nostalg
Woke up with the sun today. Glorious weather with not a cloud in the sky!,woke up with the sun today glorious weather with not a cloud in the sky,"['woke', 'sun', 'today', 'glorious', 'weather', 'cloud', 'sky']","['woke', 'sun', 'today', 'gloriou', 'weather', 'cloud', 'sky']",woke sun today gloriou weather cloud sky
"I had a nice, home cooked breakfast today.",i had a nice home cooked breakfast today,"['nice', 'home', 'cooked', 'breakfast', 'today']","['nice', 'home', 'cook', 'breakfast', 'today']",nice home cook breakfast today
"This morning I watched a beautiful sunrise, as I sipped a cup of coffee.",this morning i watched a beautiful sunrise as i sipped a cup of coffee,"['morning', 'watched', 'beautiful', 'sunrise', 'sipped', 'cup', 'coffee']","['morn', 'watch', 'beauti', 'sunris', 'sip', 'cup', 'coffe']",morn watch beauti sunris sip cup coffe
Today when my son kissed my on my cheek my world was right.,today when my son kissed my on my cheek my world was right,"['today', 'son', 'kissed', 'cheek', 'world', 'right']","['today', 'son', 'kiss', 'cheek', 'world', 'right']",today son kiss cheek world right
I got off work and checked my phone and saw that my girlfriend still loved me.,i got off work and checked my phone and saw that my girlfriend still loved me,"['got', 'work', 'checked', 'phone', 'saw', 'girlfriend', 'still', 'loved']","['got', 'work', 'check', 'phone', 'saw', 'girlfriend', 'still', 'love']",got work check phone saw girlfriend still love
I woke up early today to meet breakfast in bed made by my husband.,i woke up early today to meet breakfast in bed made by my husband,"['woke', 'early', 'today', 'meet', 'breakfast', 'bed', 'made', 'husband']","['woke', 'earli', 'today', 'meet', 'breakfast', 'bed', 'made', 'husband']",woke earli today meet breakfast bed made husband
Waking up to a fresh cup of coffee that somebody else made.,waking up to a fresh cup of coffee that somebody else made,"['waking', 'fresh', 'cup', 'coffee', 'somebody', 'else', 'made']","['wake', 'fresh', 'cup', 'coffe', 'somebodi', 'els', 'made']",wake fresh cup coffe somebodi els made
My cat jumped on chest and rubbed against my face to wake me up today.,my cat jumped on chest and rubbed against my face to wake me up today,"['cat', 'jumped', 'chest', 'rubbed', 'face', 'wake', 'today']","['cat', 'jump', 'chest', 'rub', 'face', 'wake', 'today']",cat jump chest rub face wake today
This morning I felt happy because I can fix a trouble with my bank account.,this morning i felt happy because i can fix a trouble with my bank account,"['morning', 'felt', 'happy', 'fix', 'trouble', 'bank', 'account']","['morn', 'felt', 'happi', 'fix', 'troubl', 'bank', 'account']",morn felt happi fix troubl bank account
Today I received a phone call that could potentially end my family's financial burdens. I have an interview tomorrow!,today i received a phone call that could potentially end my familys financial burdens i have an interview tomorrow,"['today', 'received', 'phone', 'call', 'could', 'potentially', 'end', 'familys', 'financial', 'burdens', 'interview', 'tomorrow']","['today', 'receiv', 'phone', 'call', 'could', 'potenti', 'end', 'famili', 'financi', 'burden', 'interview', 'tomorrow']",today receiv phone call could potenti end famili financi burden interview tomorrow
today i helped a poor man in his work. that made my day,today i helped a poor man in his work that made my day,"['today', 'helped', 'poor', 'man', 'work', 'made', 'day']","['today', 'help', 'poor', 'man', 'work', 'made', 'day']",today help poor man work made day
I ate turkey bacon and coffee this morning. I feel so satisfied.,i ate turkey bacon and coffee this morning i feel so satisfied,"['ate', 'turkey', 'bacon', 'coffee', 'morning', 'feel', 'satisfied']","['ate', 'turkey', 'bacon', 'coffe', 'morn', 'feel', 'satisfi']",ate turkey bacon coffe morn feel satisfi
I remember I was very happy when I knew that passes exams into univercity. I cried that day because I was ready to hear opposite and suddently such nice surprise,i remember i was very happy when i knew that passes exams into univercity i cried that day because i was ready to hear opposite and suddently such nice surprise,"['remember', 'happy', 'knew', 'passes', 'exams', 'univercity', 'cried', 'day', 'ready', 'hear', 'opposite', 'suddently', 'nice', 'surprise']","['rememb', 'happi', 'knew', 'pass', 'exam', 'univerc', 'cri', 'day', 'readi', 'hear', 'opposit', 'suddent', 'nice', 'surpris']",rememb happi knew pass exam univerc cri day readi hear opposit suddent nice surpris
"Today, I got to smoke a bowl in the sun.",today i got to smoke a bowl in the sun,"['today', 'got', 'smoke', 'bowl', 'sun']","['today', 'got', 'smoke', 'bowl', 'sun']",today got smoke bowl sun
Wokeup. 5th day in the gym. I see myself improving day by day and gaining a bit of muscle.,wokeup th day in the gym i see myself improving day by day and gaining a bit of muscle,"['wokeup', 'th', 'day', 'gym', 'see', 'improving', 'day', 'day', 'gaining', 'bit', 'muscle']","['wokeup', 'th', 'day', 'gym', 'see', 'improv', 'day', 'day', 'gain', 'bit', 'muscl']",wokeup th day gym see improv day day gain bit muscl
Having my morning coffee by myself and listening to the birds chirping.,having my morning coffee by myself and listening to the birds chirping,"['morning', 'coffee', 'listening', 'birds', 'chirping']","['morn', 'coffe', 'listen', 'bird', 'chirp']",morn coffe listen bird chirp
"As I woke up from a deep sleep, I opened my eyes to see my love looking back at me, smiling.  He then wrapped his arm around me and pulled me closer to gently kiss me on my lips.",as i woke up from a deep sleep i opened my eyes to see my love looking back at me smiling  he then wrapped his arm around me and pulled me closer to gently kiss me on my lips,"['woke', 'deep', 'sleep', 'opened', 'eyes', 'see', 'love', 'looking', 'back', 'smiling', 'wrapped', 'arm', 'around', 'pulled', 'closer', 'gently', 'kiss', 'lips']","['woke', 'deep', 'sleep', 'open', 'eye', 'see', 'love', 'look', 'back', 'smile', 'wrap', 'arm', 'around', 'pull', 'closer', 'gentli', 'kiss', 'lip']",woke deep sleep open eye see love look back smile wrap arm around pull closer gentli kiss lip
"I picked up my child from preschool this afternoon and she screamed """"daddy, I missed you so much!"""", and ran to me and gave me a hug.",i picked up my child from preschool this afternoon and she screamed daddy i missed you so much and ran to me and gave me a hug,"['picked', 'child', 'preschool', 'afternoon', 'screamed', 'daddy', 'missed', 'much', 'ran', 'gave', 'hug']","['pick', 'child', 'preschool', 'afternoon', 'scream', 'daddi', 'miss', 'much', 'ran', 'gave', 'hug']",pick child preschool afternoon scream daddi miss much ran gave hug
Watching my kids being silly in the car.,watching my kids being silly in the car,"['watching', 'kids', 'silly', 'car']","['watch', 'kid', 'silli', 'car']",watch kid silli car
This morning my daughter put her shoes away without me asking showing that all those years of nagging have paid off.,this morning my daughter put her shoes away without me asking showing that all those years of nagging have paid off,"['morning', 'daughter', 'put', 'shoes', 'away', 'without', 'asking', 'showing', 'years', 'nagging', 'paid']","['morn', 'daughter', 'put', 'shoe', 'away', 'without', 'ask', 'show', 'year', 'nag', 'paid']",morn daughter put shoe away without ask show year nag paid
The day I got saved and my  life was changed!,the day i got saved and my  life was changed,"['day', 'got', 'saved', 'life', 'changed']","['day', 'got', 'save', 'life', 'chang']",day got save life chang
I spent some time talking with Al while at work this morning.,i spent some time talking with al while at work this morning,"['spent', 'time', 'talking', 'al', 'work', 'morning']","['spent', 'time', 'talk', 'al', 'work', 'morn']",spent time talk al work morn
I was woken up by my fiance calling me on the phone and telling me she loved me.,i was woken up by my fiance calling me on the phone and telling me she loved me,"['woken', 'fiance', 'calling', 'phone', 'telling', 'loved']","['woken', 'fianc', 'call', 'phone', 'tell', 'love']",woken fianc call phone tell love
On my way home to see my boyfriend,on my way home to see my boyfriend,"['way', 'home', 'see', 'boyfriend']","['way', 'home', 'see', 'boyfriend']",way home see boyfriend
listening to the rain in the morning,listening to the rain in the morning,"['listening', 'rain', 'morning']","['listen', 'rain', 'morn']",listen rain morn
Holding our cat is one of the happiest moments for me everyday. She is so warm and soft.,holding our cat is one of the happiest moments for me everyday she is so warm and soft,"['holding', 'cat', 'one', 'happiest', 'moments', 'everyday', 'warm', 'soft']","['hold', 'cat', 'one', 'happiest', 'moment', 'everyday', 'warm', 'soft']",hold cat one happiest moment everyday warm soft
Today I just woke up with the sun in my face and it was so satisfying.,today i just woke up with the sun in my face and it was so satisfying,"['today', 'woke', 'sun', 'face', 'satisfying']","['today', 'woke', 'sun', 'face', 'satisfi']",today woke sun face satisfi
Today I received the sweetest surprise ever: my sister Sarah is pregnant. My family is about to get bigger.,today i received the sweetest surprise ever my sister sarah is pregnant my family is about to get bigger,"['today', 'received', 'sweetest', 'surprise', 'ever', 'sister', 'sarah', 'pregnant', 'family', 'get', 'bigger']","['today', 'receiv', 'sweetest', 'surpris', 'ever', 'sister', 'sarah', 'pregnant', 'famili', 'get', 'bigger']",today receiv sweetest surpris ever sister sarah pregnant famili get bigger
My sister arrived for a visit from out of state.,my sister arrived for a visit from out of state,"['sister', 'arrived', 'visit', 'state']","['sister', 'arriv', 'visit', 'state']",sister arriv visit state
"Had super cheesy pasta for dinner tonight, with home-made white sauce. Best thing ever and I ate too much as I always do but It was totally worth it. Could have it for every meal ever - so satisfying!",had super cheesy pasta for dinner tonight with homemade white sauce best thing ever and i ate too much as i always do but it was totally worth it could have it for every meal ever  so satisfying,"['super', 'cheesy', 'pasta', 'dinner', 'tonight', 'homemade', 'white', 'sauce', 'best', 'thing', 'ever', 'ate', 'much', 'always', 'totally', 'worth', 'could', 'every', 'meal', 'ever', 'satisfying']","['super', 'cheesi', 'pasta', 'dinner', 'tonight', 'homemad', 'white', 'sauc', 'best', 'thing', 'ever', 'ate', 'much', 'alway', 'total', 'worth', 'could', 'everi', 'meal', 'ever', 'satisfi']",super cheesi pasta dinner tonight homemad white sauc best thing ever ate much alway total worth could everi meal ever satisfi
In the morning when i woke up and my mom is already making my breakfast with love.,in the morning when i woke up and my mom is already making my breakfast with love,"['morning', 'woke', 'mom', 'already', 'making', 'breakfast', 'love']","['morn', 'woke', 'mom', 'alreadi', 'make', 'breakfast', 'love']",morn woke mom alreadi make breakfast love
I had a delicious scone for breakfast.,i had a delicious scone for breakfast,"['delicious', 'scone', 'breakfast']","['delici', 'scone', 'breakfast']",delici scone breakfast
I got to ride a very friendly deer at Salmon La Sac.,i got to ride a very friendly deer at salmon la sac,"['got', 'ride', 'friendly', 'deer', 'salmon', 'la', 'sac']","['got', 'ride', 'friendli', 'deer', 'salmon', 'la', 'sac']",got ride friendli deer salmon la sac
I won a drawing for a 50 dollar gift card!,i won a drawing for a  dollar gift card,"['drawing', 'dollar', 'gift', 'card']","['draw', 'dollar', 'gift', 'card']",draw dollar gift card
I was very happy when I finally finished work and could go home and rest.,i was very happy when i finally finished work and could go home and rest,"['happy', 'finally', 'finished', 'work', 'could', 'go', 'home', 'rest']","['happi', 'final', 'finish', 'work', 'could', 'go', 'home', 'rest']",happi final finish work could go home rest
"I woke up with the birds singing this morning. This peaceful awakening was really good. I love birds, they are magic.",i woke up with the birds singing this morning this peaceful awakening was really good i love birds they are magic,"['woke', 'birds', 'singing', 'morning', 'peaceful', 'awakening', 'really', 'good', 'love', 'birds', 'magic']","['woke', 'bird', 'sing', 'morn', 'peac', 'awaken', 'realli', 'good', 'love', 'bird', 'magic']",woke bird sing morn peac awaken realli good love bird magic
Sweet doggy excitedly wagging his tail.,sweet doggy excitedly wagging his tail,"['sweet', 'doggy', 'excitedly', 'wagging', 'tail']","['sweet', 'doggi', 'excitedli', 'wag', 'tail']",sweet doggi excitedli wag tail
Yesterday I won the game by making a incredible shot over the defender.,yesterday i won the game by making a incredible shot over the defender,"['yesterday', 'game', 'making', 'incredible', 'shot', 'defender']","['yesterday', 'game', 'make', 'incred', 'shot', 'defend']",yesterday game make incred shot defend
Spending time with family.,spending time with family,"['spending', 'time', 'family']","['spend', 'time', 'famili']",spend time famili
Rode my bike to work. The weather was hot but there was a breeze. Felt good to get exercise.,rode my bike to work the weather was hot but there was a breeze felt good to get exercise,"['rode', 'bike', 'work', 'weather', 'hot', 'breeze', 'felt', 'good', 'get', 'exercise']","['rode', 'bike', 'work', 'weather', 'hot', 'breez', 'felt', 'good', 'get', 'exercis']",rode bike work weather hot breez felt good get exercis
When Kav called me her best friend.,when kav called me her best friend,"['kav', 'called', 'best', 'friend']","['kav', 'call', 'best', 'friend']",kav call best friend
The morning birds flying in group formation fill me with a sense of peace and natural wonder.,the morning birds flying in group formation fill me with a sense of peace and natural wonder,"['morning', 'birds', 'flying', 'group', 'formation', 'fill', 'sense', 'peace', 'natural', 'wonder']","['morn', 'bird', 'fli', 'group', 'format', 'fill', 'sens', 'peac', 'natur', 'wonder']",morn bird fli group format fill sens peac natur wonder
