text,cleaned_text,tokens,stemmed,processed_text
I went to the beach with my parents.  It was a really nice day and I saw a fish while I was swimming!  Afterward we got ice cream cones.,i went to the beach with my parents  it was a really nice day and i saw a fish while i was swimming  afterward we got ice cream cones,"['went', 'beach', 'parents', 'really', 'nice', 'day', 'saw', 'fish', 'swimming', 'afterward', 'got', 'ice', 'cream', 'cones']","['went', 'beach', 'parent', 'realli', 'nice', 'day', 'saw', 'fish', 'swim', 'afterward', 'got', 'ice', 'cream', 'cone']",went beach parent realli nice day saw fish swim afterward got ice cream cone
when i woke up in morning receive message from my love .,when i woke up in morning receive message from my love ,"['woke', 'morning', 'receive', 'message', 'love']","['woke', 'morn', 'receiv', 'messag', 'love']",woke morn receiv messag love
When I woke up early before running and felt fresh,when i woke up early before running and felt fresh,"['woke', 'early', 'running', 'felt', 'fresh']","['woke', 'earli', 'run', 'felt', 'fresh']",woke earli run felt fresh
Bringing my daughter to school always brings us closer together.,bringing my daughter to school always brings us closer together,"['bringing', 'daughter', 'school', 'always', 'brings', 'us', 'closer', 'together']","['bring', 'daughter', 'school', 'alway', 'bring', 'us', 'closer', 'togeth']",bring daughter school alway bring us closer togeth
I cuddled with my dogs this morning.,i cuddled with my dogs this morning,"['cuddled', 'dogs', 'morning']","['cuddl', 'dog', 'morn']",cuddl dog morn
i got championship trophy in my school level.,i got championship trophy in my school level,"['got', 'championship', 'trophy', 'school', 'level']","['got', 'championship', 'trophi', 'school', 'level']",got championship trophi school level
every day when I wake up and see my daughter asleep. She brightens my day,every day when i wake up and see my daughter asleep she brightens my day,"['every', 'day', 'wake', 'see', 'daughter', 'asleep', 'brightens', 'day']","['everi', 'day', 'wake', 'see', 'daughter', 'asleep', 'brighten', 'day']",everi day wake see daughter asleep brighten day
Having lunch with my youngest and talking about the upcoming school year.,having lunch with my youngest and talking about the upcoming school year,"['lunch', 'youngest', 'talking', 'upcoming', 'school', 'year']","['lunch', 'youngest', 'talk', 'upcom', 'school', 'year']",lunch youngest talk upcom school year
Oh boy there's coffee and bacon waiting for me when I woke up this morning!,oh boy theres coffee and bacon waiting for me when i woke up this morning,"['oh', 'boy', 'theres', 'coffee', 'bacon', 'waiting', 'woke', 'morning']","['oh', 'boy', 'there', 'coffe', 'bacon', 'wait', 'woke', 'morn']",oh boy there coffe bacon wait woke morn
Woke up early for work. Took a hit of and was feeling energized. Left on time and was happy.,woke up early for work took a hit of and was feeling energized left on time and was happy,"['woke', 'early', 'work', 'took', 'hit', 'feeling', 'energized', 'left', 'time', 'happy']","['woke', 'earli', 'work', 'took', 'hit', 'feel', 'energ', 'left', 'time', 'happi']",woke earli work took hit feel energ left time happi
I received an invitation to interview for my dream job.,i received an invitation to interview for my dream job,"['received', 'invitation', 'interview', 'dream', 'job']","['receiv', 'invit', 'interview', 'dream', 'job']",receiv invit interview dream job
My girlfriend sent me a text telling me she loves me when she woke up.,my girlfriend sent me a text telling me she loves me when she woke up,"['girlfriend', 'sent', 'text', 'telling', 'loves', 'woke']","['girlfriend', 'sent', 'text', 'tell', 'love', 'woke']",girlfriend sent text tell love woke
Fun Day with the kids today.,fun day with the kids today,"['fun', 'day', 'kids', 'today']","['fun', 'day', 'kid', 'today']",fun day kid today
After so many days of planning I finally went to the new restaurant with my partner.,after so many days of planning i finally went to the new restaurant with my partner,"['many', 'days', 'planning', 'finally', 'went', 'new', 'restaurant', 'partner']","['mani', 'day', 'plan', 'final', 'went', 'new', 'restaur', 'partner']",mani day plan final went new restaur partner
Jojo & Stitch making friends with another dog while on their walk.,jojo  stitch making friends with another dog while on their walk,"['jojo', 'stitch', 'making', 'friends', 'another', 'dog', 'walk']","['jojo', 'stitch', 'make', 'friend', 'anoth', 'dog', 'walk']",jojo stitch make friend anoth dog walk
Got a cute girls number. Have been texting quite a bit.,got a cute girls number have been texting quite a bit,"['got', 'cute', 'girls', 'number', 'texting', 'quite', 'bit']","['got', 'cute', 'girl', 'number', 'text', 'quit', 'bit']",got cute girl number text quit bit
I was playing with both of my boys.,i was playing with both of my boys,"['playing', 'boys']","['play', 'boy']",play boy
My girlfriend sent me a package with my favorite candy in it.,my girlfriend sent me a package with my favorite candy in it,"['girlfriend', 'sent', 'package', 'favorite', 'candy']","['girlfriend', 'sent', 'packag', 'favorit', 'candi']",girlfriend sent packag favorit candi
Seeing my friends.,seeing my friends,"['seeing', 'friends']","['see', 'friend']",see friend
My wife just made chocolate chip cookies!,my wife just made chocolate chip cookies,"['wife', 'made', 'chocolate', 'chip', 'cookies']","['wife', 'made', 'chocol', 'chip', 'cooki']",wife made chocol chip cooki
I didn't have work this morning and felt happy that I didn't have to face any kind of anxiety.,i didnt have work this morning and felt happy that i didnt have to face any kind of anxiety,"['didnt', 'work', 'morning', 'felt', 'happy', 'didnt', 'face', 'kind', 'anxiety']","['didnt', 'work', 'morn', 'felt', 'happi', 'didnt', 'face', 'kind', 'anxieti']",didnt work morn felt happi didnt face kind anxieti
My happy moment today was taking a cold shower after not having done anything all day.,my happy moment today was taking a cold shower after not having done anything all day,"['happy', 'moment', 'today', 'taking', 'cold', 'shower', 'done', 'anything', 'day']","['happi', 'moment', 'today', 'take', 'cold', 'shower', 'done', 'anyth', 'day']",happi moment today take cold shower done anyth day
I celebrated my friend's birthday today.,i celebrated my friends birthday today,"['celebrated', 'friends', 'birthday', 'today']","['celebr', 'friend', 'birthday', 'today']",celebr friend birthday today
"Toaday,Going out with girlfriend",toadaygoing out with girlfriend,"['toadaygoing', 'girlfriend']","['toadaygo', 'girlfriend']",toadaygo girlfriend
"Sitting on a beach at sunset, watching the waves roll in and feeling the cool ocean breeze flow through my hair.",sitting on a beach at sunset watching the waves roll in and feeling the cool ocean breeze flow through my hair,"['sitting', 'beach', 'sunset', 'watching', 'waves', 'roll', 'feeling', 'cool', 'ocean', 'breeze', 'flow', 'hair']","['sit', 'beach', 'sunset', 'watch', 'wave', 'roll', 'feel', 'cool', 'ocean', 'breez', 'flow', 'hair']",sit beach sunset watch wave roll feel cool ocean breez flow hair
Awesome studio session with Carl today.,awesome studio session with carl today,"['awesome', 'studio', 'session', 'carl', 'today']","['awesom', 'studio', 'session', 'carl', 'today']",awesom studio session carl today
First chilly night in a long time. Fall is coming and I couldn't be more excited.,first chilly night in a long time fall is coming and i couldnt be more excited,"['first', 'chilly', 'night', 'long', 'time', 'fall', 'coming', 'couldnt', 'excited']","['first', 'chilli', 'night', 'long', 'time', 'fall', 'come', 'couldnt', 'excit']",first chilli night long time fall come couldnt excit
I had the best breakfast today! Apple filled maple bar from Baker's Pride.,i had the best breakfast today apple filled maple bar from bakers pride,"['best', 'breakfast', 'today', 'apple', 'filled', 'maple', 'bar', 'bakers', 'pride']","['best', 'breakfast', 'today', 'appl', 'fill', 'mapl', 'bar', 'baker', 'pride']",best breakfast today appl fill mapl bar baker pride
I woke up and felt refreshed and the sun was coming through the window. I wasn't even upset about it being bright in the room.,i woke up and felt refreshed and the sun was coming through the window i wasnt even upset about it being bright in the room,"['woke', 'felt', 'refreshed', 'sun', 'coming', 'window', 'wasnt', 'even', 'upset', 'bright', 'room']","['woke', 'felt', 'refresh', 'sun', 'come', 'window', 'wasnt', 'even', 'upset', 'bright', 'room']",woke felt refresh sun come window wasnt even upset bright room
I went for a run today and ran my fastest mile ever.,i went for a run today and ran my fastest mile ever,"['went', 'run', 'today', 'ran', 'fastest', 'mile', 'ever']","['went', 'run', 'today', 'ran', 'fastest', 'mile', 'ever']",went run today ran fastest mile ever
Got my 1st puppy today from the pound,got my st puppy today from the pound,"['got', 'st', 'puppy', 'today', 'pound']","['got', 'st', 'puppi', 'today', 'pound']",got st puppi today pound
"Today,I was able to concentrate between my eyebrows during meditation.",todayi was able to concentrate between my eyebrows during meditation,"['todayi', 'able', 'concentrate', 'eyebrows', 'meditation']","['todayi', 'abl', 'concentr', 'eyebrow', 'medit']",todayi abl concentr eyebrow medit
I received a great evaluation at work today.,i received a great evaluation at work today,"['received', 'great', 'evaluation', 'work', 'today']","['receiv', 'great', 'evalu', 'work', 'today']",receiv great evalu work today
Yesterday I went to a nice Italian Restaurant. The dinner was tasty and nice.,yesterday i went to a nice italian restaurant the dinner was tasty and nice,"['yesterday', 'went', 'nice', 'italian', 'restaurant', 'dinner', 'tasty', 'nice']","['yesterday', 'went', 'nice', 'italian', 'restaur', 'dinner', 'tasti', 'nice']",yesterday went nice italian restaur dinner tasti nice
i went for a one mile jog earlier,i went for a one mile jog earlier,"['went', 'one', 'mile', 'jog', 'earlier']","['went', 'one', 'mile', 'jog', 'earlier']",went one mile jog earlier
I woke up this morning and my room smelled like my candles I purchased yesterday.,i woke up this morning and my room smelled like my candles i purchased yesterday,"['woke', 'morning', 'room', 'smelled', 'like', 'candles', 'purchased', 'yesterday']","['woke', 'morn', 'room', 'smell', 'like', 'candl', 'purchas', 'yesterday']",woke morn room smell like candl purchas yesterday
"I woke up this morning, tired from trying to get myoldest child to sleep last night, and walked in to get my baby from his crib and he was smiling so big and so happy to see me. It made my day.",i woke up this morning tired from trying to get myoldest child to sleep last night and walked in to get my baby from his crib and he was smiling so big and so happy to see me it made my day,"['woke', 'morning', 'tired', 'trying', 'get', 'myoldest', 'child', 'sleep', 'last', 'night', 'walked', 'get', 'baby', 'crib', 'smiling', 'big', 'happy', 'see', 'made', 'day']","['woke', 'morn', 'tire', 'tri', 'get', 'myoldest', 'child', 'sleep', 'last', 'night', 'walk', 'get', 'babi', 'crib', 'smile', 'big', 'happi', 'see', 'made', 'day']",woke morn tire tri get myoldest child sleep last night walk get babi crib smile big happi see made day
I talked to my girlfriend who lives in another state today for a couple hours.,i talked to my girlfriend who lives in another state today for a couple hours,"['talked', 'girlfriend', 'lives', 'another', 'state', 'today', 'couple', 'hours']","['talk', 'girlfriend', 'live', 'anoth', 'state', 'today', 'coupl', 'hour']",talk girlfriend live anoth state today coupl hour
"Finally was able to get my girlfriend on a bicycle, and she loved it. Absolutely made my day.",finally was able to get my girlfriend on a bicycle and she loved it absolutely made my day,"['finally', 'able', 'get', 'girlfriend', 'bicycle', 'loved', 'absolutely', 'made', 'day']","['final', 'abl', 'get', 'girlfriend', 'bicycl', 'love', 'absolut', 'made', 'day']",final abl get girlfriend bicycl love absolut made day
I enjoyed my morning coffee while checking emails.,i enjoyed my morning coffee while checking emails,"['enjoyed', 'morning', 'coffee', 'checking', 'emails']","['enjoy', 'morn', 'coffe', 'check', 'email']",enjoy morn coffe check email
I found a dollar on the sidewalk.,i found a dollar on the sidewalk,"['found', 'dollar', 'sidewalk']","['found', 'dollar', 'sidewalk']",found dollar sidewalk
"I thoroughly enjoyed my morning cup of coffee on the front deck. It has been raining, which is very peaceful, and the weather is cooling.",i thoroughly enjoyed my morning cup of coffee on the front deck it has been raining which is very peaceful and the weather is cooling,"['thoroughly', 'enjoyed', 'morning', 'cup', 'coffee', 'front', 'deck', 'raining', 'peaceful', 'weather', 'cooling']","['thoroughli', 'enjoy', 'morn', 'cup', 'coffe', 'front', 'deck', 'rain', 'peac', 'weather', 'cool']",thoroughli enjoy morn cup coffe front deck rain peac weather cool
Sabrina and I splashed up and down in mud puddles!  It was so cute!,sabrina and i splashed up and down in mud puddles  it was so cute,"['sabrina', 'splashed', 'mud', 'puddles', 'cute']","['sabrina', 'splash', 'mud', 'puddl', 'cute']",sabrina splash mud puddl cute
Waking up around noon. Going out into the living room and having my big orange cat jump on my lap for attention.,waking up around noon going out into the living room and having my big orange cat jump on my lap for attention,"['waking', 'around', 'noon', 'going', 'living', 'room', 'big', 'orange', 'cat', 'jump', 'lap', 'attention']","['wake', 'around', 'noon', 'go', 'live', 'room', 'big', 'orang', 'cat', 'jump', 'lap', 'attent']",wake around noon go live room big orang cat jump lap attent
When i get a brand-new Part for my computer.,when i get a brandnew part for my computer,"['get', 'brandnew', 'part', 'computer']","['get', 'brandnew', 'part', 'comput']",get brandnew part comput
Met Abby's new teacher today!,met abbys new teacher today,"['met', 'abbys', 'new', 'teacher', 'today']","['met', 'abbi', 'new', 'teacher', 'today']",met abbi new teacher today
We had a lovely time at the beach.,we had a lovely time at the beach,"['lovely', 'time', 'beach']","['love', 'time', 'beach']",love time beach
Feeling nostalgic after watching old episodes of Justice League animated series. It was like reliving childhood days.,feeling nostalgic after watching old episodes of justice league animated series it was like reliving childhood days,"['feeling', 'nostalgic', 'watching', 'old', 'episodes', 'justice', 'league', 'animated', 'series', 'like', 'reliving', 'childhood', 'days']","['feel', 'nostalg', 'watch', 'old', 'episod', 'justic', 'leagu', 'anim', 'seri', 'like', 'reliv', 'childhood', 'day']",feel nostalg watch old episod justic leagu anim seri like reliv childhood day
talk to some people that survived the flooding. great to hear stories of heroism in my own backyard.,talk to some people that survived the flooding great to hear stories of heroism in my own backyard,"['talk', 'people', 'survived', 'flooding', 'great', 'hear', 'stories', 'heroism', 'backyard']","['talk', 'peopl', 'surviv', 'flood', 'great', 'hear', 'stori', 'heroism', 'backyard']",talk peopl surviv flood great hear stori heroism backyard
Biked into the city this morning for a meeting and got the best views of the early morning sky. Totally energized me.,biked into the city this morning for a meeting and got the best views of the early morning sky totally energized me,"['biked', 'city', 'morning', 'meeting', 'got', 'best', 'views', 'early', 'morning', 'sky', 'totally', 'energized']","['bike', 'citi', 'morn', 'meet', 'got', 'best', 'view', 'earli', 'morn', 'sky', 'total', 'energ']",bike citi morn meet got best view earli morn sky total energ
Matt came up from behind me this morning and wrapped his arms around me.  Then he kissed my neck and rubbed my back.  It was nice.,matt came up from behind me this morning and wrapped his arms around me  then he kissed my neck and rubbed my back  it was nice,"['matt', 'came', 'behind', 'morning', 'wrapped', 'arms', 'around', 'kissed', 'neck', 'rubbed', 'back', 'nice']","['matt', 'came', 'behind', 'morn', 'wrap', 'arm', 'around', 'kiss', 'neck', 'rub', 'back', 'nice']",matt came behind morn wrap arm around kiss neck rub back nice
I took a relaxing nap on the beach today.,i took a relaxing nap on the beach today,"['took', 'relaxing', 'nap', 'beach', 'today']","['took', 'relax', 'nap', 'beach', 'today']",took relax nap beach today
Watching my son playing a game and he is doing very good.,watching my son playing a game and he is doing very good,"['watching', 'son', 'playing', 'game', 'good']","['watch', 'son', 'play', 'game', 'good']",watch son play game good
"yesterday I went for a trip with my old friends,feeling awesome",yesterday i went for a trip with my old friendsfeeling awesome,"['yesterday', 'went', 'trip', 'old', 'friendsfeeling', 'awesome']","['yesterday', 'went', 'trip', 'old', 'friendsfeel', 'awesom']",yesterday went trip old friendsfeel awesom
"Came home to see my dog, he loves me so much.",came home to see my dog he loves me so much,"['came', 'home', 'see', 'dog', 'loves', 'much']","['came', 'home', 'see', 'dog', 'love', 'much']",came home see dog love much
No crying at drop off this morning.,no crying at drop off this morning,"['crying', 'drop', 'morning']","['cri', 'drop', 'morn']",cri drop morn
"Went to starbucks and got a nice, big, yummy coffee.",went to starbucks and got a nice big yummy coffee,"['went', 'starbucks', 'got', 'nice', 'big', 'yummy', 'coffee']","['went', 'starbuck', 'got', 'nice', 'big', 'yummi', 'coffe']",went starbuck got nice big yummi coffe
Got a personal record in my bench press this morning at my workout.,got a personal record in my bench press this morning at my workout,"['got', 'personal', 'record', 'bench', 'press', 'morning', 'workout']","['got', 'person', 'record', 'bench', 'press', 'morn', 'workout']",got person record bench press morn workout
at last finished with the application process for my dream university.,at last finished with the application process for my dream university,"['last', 'finished', 'application', 'process', 'dream', 'university']","['last', 'finish', 'applic', 'process', 'dream', 'univers']",last finish applic process dream univers
"Today on my way to pick up dinner, I heard my current favorite song twice.",today on my way to pick up dinner i heard my current favorite song twice,"['today', 'way', 'pick', 'dinner', 'heard', 'current', 'favorite', 'song', 'twice']","['today', 'way', 'pick', 'dinner', 'heard', 'current', 'favorit', 'song', 'twice']",today way pick dinner heard current favorit song twice
I kissed my girlfriend in the hot tub,i kissed my girlfriend in the hot tub,"['kissed', 'girlfriend', 'hot', 'tub']","['kiss', 'girlfriend', 'hot', 'tub']",kiss girlfriend hot tub
Went on an interview. Easier than I thought. Looks promising!,went on an interview easier than i thought looks promising,"['went', 'interview', 'easier', 'thought', 'looks', 'promising']","['went', 'interview', 'easier', 'thought', 'look', 'promis']",went interview easier thought look promis
Found $5 in the street!,found  in the street,"['found', 'street']","['found', 'street']",found street
Saw the sunrise over the ocean.,saw the sunrise over the ocean,"['saw', 'sunrise', 'ocean']","['saw', 'sunris', 'ocean']",saw sunris ocean
I greeted my children this morning with hot pancakes and fresh fruit.,i greeted my children this morning with hot pancakes and fresh fruit,"['greeted', 'children', 'morning', 'hot', 'pancakes', 'fresh', 'fruit']","['greet', 'children', 'morn', 'hot', 'pancak', 'fresh', 'fruit']",greet children morn hot pancak fresh fruit
My girlfriend wore a a traditional dress just to make me happy.,my girlfriend wore a a traditional dress just to make me happy,"['girlfriend', 'wore', 'traditional', 'dress', 'make', 'happy']","['girlfriend', 'wore', 'tradit', 'dress', 'make', 'happi']",girlfriend wore tradit dress make happi
Got to catch up with Mr. Lew today. He invited me to get involved with the society.,got to catch up with mr lew today he invited me to get involved with the society,"['got', 'catch', 'mr', 'lew', 'today', 'invited', 'get', 'involved', 'society']","['got', 'catch', 'mr', 'lew', 'today', 'invit', 'get', 'involv', 'societi']",got catch mr lew today invit get involv societi
Sixteen hours traveling. Finally arrived home. Summer holidays starting tomorrow.,sixteen hours traveling finally arrived home summer holidays starting tomorrow,"['sixteen', 'hours', 'traveling', 'finally', 'arrived', 'home', 'summer', 'holidays', 'starting', 'tomorrow']","['sixteen', 'hour', 'travel', 'final', 'arriv', 'home', 'summer', 'holiday', 'start', 'tomorrow']",sixteen hour travel final arriv home summer holiday start tomorrow
Today I wrote a letter to a close friend. I smile thinking of her opening it and remembering me.,today i wrote a letter to a close friend i smile thinking of her opening it and remembering me,"['today', 'wrote', 'letter', 'close', 'friend', 'smile', 'thinking', 'opening', 'remembering']","['today', 'wrote', 'letter', 'close', 'friend', 'smile', 'think', 'open', 'rememb']",today wrote letter close friend smile think open rememb
Waking up each morning and fighting for what it is I believe in!,waking up each morning and fighting for what it is i believe in,"['waking', 'morning', 'fighting', 'believe']","['wake', 'morn', 'fight', 'believ']",wake morn fight believ
I helped my 8 year old with his math homework and he was so pleased. I could see him learning and it made me so happy.,i helped my  year old with his math homework and he was so pleased i could see him learning and it made me so happy,"['helped', 'year', 'old', 'math', 'homework', 'pleased', 'could', 'see', 'learning', 'made', 'happy']","['help', 'year', 'old', 'math', 'homework', 'pleas', 'could', 'see', 'learn', 'made', 'happi']",help year old math homework pleas could see learn made happi
I woke up in the early morning and had time to go to beach with my dog Brownny,i woke up in the early morning and had time to go to beach with my dog brownny,"['woke', 'early', 'morning', 'time', 'go', 'beach', 'dog', 'brownny']","['woke', 'earli', 'morn', 'time', 'go', 'beach', 'dog', 'brownni']",woke earli morn time go beach dog brownni
Yesterday my puppy behaved very nice and waited patiently for his food.,yesterday my puppy behaved very nice and waited patiently for his food,"['yesterday', 'puppy', 'behaved', 'nice', 'waited', 'patiently', 'food']","['yesterday', 'puppi', 'behav', 'nice', 'wait', 'patient', 'food']",yesterday puppi behav nice wait patient food
Going for a morning run,going for a morning run,"['going', 'morning', 'run']","['go', 'morn', 'run']",go morn run
"Happy moment for our country and me,the quarter final is just over and one of our players entered the semifinal of women's shuttlecock in the Rio Olympics beating the world No 2.",happy moment for our country and methe quarter final is just over and one of our players entered the semifinal of womens shuttlecock in the rio olympics beating the world no ,"['happy', 'moment', 'country', 'methe', 'quarter', 'final', 'one', 'players', 'entered', 'semifinal', 'womens', 'shuttlecock', 'rio', 'olympics', 'beating', 'world']","['happi', 'moment', 'countri', 'meth', 'quarter', 'final', 'one', 'player', 'enter', 'semifin', 'women', 'shuttlecock', 'rio', 'olymp', 'beat', 'world']",happi moment countri meth quarter final one player enter semifin women shuttlecock rio olymp beat world
Got a kiss from the love of my life before he left for work.,got a kiss from the love of my life before he left for work,"['got', 'kiss', 'love', 'life', 'left', 'work']","['got', 'kiss', 'love', 'life', 'left', 'work']",got kiss love life left work
Just stepped out into the beautiful morning with my first cup of coffee.,just stepped out into the beautiful morning with my first cup of coffee,"['stepped', 'beautiful', 'morning', 'first', 'cup', 'coffee']","['step', 'beauti', 'morn', 'first', 'cup', 'coffe']",step beauti morn first cup coffe
I got to sleep in this morning.,i got to sleep in this morning,"['got', 'sleep', 'morning']","['got', 'sleep', 'morn']",got sleep morn
Began a new writing project this morning--super excited!!!,began a new writing project this morningsuper excited,"['began', 'new', 'writing', 'project', 'morningsuper', 'excited']","['began', 'new', 'write', 'project', 'morningsup', 'excit']",began new write project morningsup excit
I had a great night out with my family today.,i had a great night out with my family today,"['great', 'night', 'family', 'today']","['great', 'night', 'famili', 'today']",great night famili today
"Got up early morning, a session of yoga relaxed me",got up early morning a session of yoga relaxed me,"['got', 'early', 'morning', 'session', 'yoga', 'relaxed']","['got', 'earli', 'morn', 'session', 'yoga', 'relax']",got earli morn session yoga relax
My boss wasn't in the office today.  Very peaceful.,my boss wasnt in the office today  very peaceful,"['boss', 'wasnt', 'office', 'today', 'peaceful']","['boss', 'wasnt', 'offic', 'today', 'peac']",boss wasnt offic today peac
I watched a great TV show while petting my cat today.,i watched a great tv show while petting my cat today,"['watched', 'great', 'tv', 'show', 'petting', 'cat', 'today']","['watch', 'great', 'tv', 'show', 'pet', 'cat', 'today']",watch great tv show pet cat today
I told her that I liked her and she responded positively. It was one of my best days.,i told her that i liked her and she responded positively it was one of my best days,"['told', 'liked', 'responded', 'positively', 'one', 'best', 'days']","['told', 'like', 'respond', 'posit', 'one', 'best', 'day']",told like respond posit one best day
