text,cleaned_text,tokens,stemmed,processed_text
"Today took my pet to vet clinic and came to know she was carrying, so excited and surprised for my fur baby.",today took my pet to vet clinic and came to know she was carrying so excited and surprised for my fur baby,"['today', 'took', 'pet', 'vet', 'clinic', 'came', 'know', 'carrying', 'excited', 'surprised', 'fur', 'baby']","['today', 'took', 'pet', 'vet', 'clinic', 'came', 'know', 'carri', 'excit', 'surpris', 'fur', 'babi']",today took pet vet clinic came know carri excit surpris fur babi
"I found a new aerobic at the gym, it was pulling a rope, sitting down, I was so happy because I burned 240 calories in 16 minutes",i found a new aerobic at the gym it was pulling a rope sitting down i was so happy because i burned  calories in  minutes,"['found', 'new', 'aerobic', 'gym', 'pulling', 'rope', 'sitting', 'happy', 'burned', 'calories', 'minutes']","['found', 'new', 'aerob', 'gym', 'pull', 'rope', 'sit', 'happi', 'burn', 'calori', 'minut']",found new aerob gym pull rope sit happi burn calori minut
The best moment when I won dota2 championship,the best moment when i won dota championship,"['best', 'moment', 'dota', 'championship']","['best', 'moment', 'dota', 'championship']",best moment dota championship
Slept in and woke up feeling rested. Coffee tasted great.,slept in and woke up feeling rested coffee tasted great,"['slept', 'woke', 'feeling', 'rested', 'coffee', 'tasted', 'great']","['slept', 'woke', 'feel', 'rest', 'coffe', 'tast', 'great']",slept woke feel rest coffe tast great
"I went to a friend's birthday party, and we played fun games.",i went to a friends birthday party and we played fun games,"['went', 'friends', 'birthday', 'party', 'played', 'fun', 'games']","['went', 'friend', 'birthday', 'parti', 'play', 'fun', 'game']",went friend birthday parti play fun game
My husband and I after working dinner day cooking together while my daughter had about how was your day at school.,my husband and i after working dinner day cooking together while my daughter had about how was your day at school,"['husband', 'working', 'dinner', 'day', 'cooking', 'together', 'daughter', 'day', 'school']","['husband', 'work', 'dinner', 'day', 'cook', 'togeth', 'daughter', 'day', 'school']",husband work dinner day cook togeth daughter day school
Elizabeth's fever finally broke this morning. Now I can relax.,elizabeths fever finally broke this morning now i can relax,"['elizabeths', 'fever', 'finally', 'broke', 'morning', 'relax']","['elizabeth', 'fever', 'final', 'broke', 'morn', 'relax']",elizabeth fever final broke morn relax
"I woke up extremely early today, making my day productive and me happy.",i woke up extremely early today making my day productive and me happy,"['woke', 'extremely', 'early', 'today', 'making', 'day', 'productive', 'happy']","['woke', 'extrem', 'earli', 'today', 'make', 'day', 'product', 'happi']",woke extrem earli today make day product happi
A stroll in the park with the love of my life today.,a stroll in the park with the love of my life today,"['stroll', 'park', 'love', 'life', 'today']","['stroll', 'park', 'love', 'life', 'today']",stroll park love life today
"The cute baby rabbit was in my yard again today, I sure hope he comes back tomorrow!",the cute baby rabbit was in my yard again today i sure hope he comes back tomorrow,"['cute', 'baby', 'rabbit', 'yard', 'today', 'sure', 'hope', 'comes', 'back', 'tomorrow']","['cute', 'babi', 'rabbit', 'yard', 'today', 'sure', 'hope', 'come', 'back', 'tomorrow']",cute babi rabbit yard today sure hope come back tomorrow
There was no traffic getting to work today.,there was no traffic getting to work today,"['traffic', 'getting', 'work', 'today']","['traffic', 'get', 'work', 'today']",traffic get work today
I can hardly believe that I finally graduated. My parents were very proud.,i can hardly believe that i finally graduated my parents were very proud,"['hardly', 'believe', 'finally', 'graduated', 'parents', 'proud']","['hardli', 'believ', 'final', 'graduat', 'parent', 'proud']",hardli believ final graduat parent proud
Going to the beach with friends,going to the beach with friends,"['going', 'beach', 'friends']","['go', 'beach', 'friend']",go beach friend
"Today morning my lovable, an year old kid started walking alone, seeing that am very happy.",today morning my lovable an year old kid started walking alone seeing that am very happy,"['today', 'morning', 'lovable', 'year', 'old', 'kid', 'started', 'walking', 'alone', 'seeing', 'happy']","['today', 'morn', 'lovabl', 'year', 'old', 'kid', 'start', 'walk', 'alon', 'see', 'happi']",today morn lovabl year old kid start walk alon see happi
I enjoy going to the gym early in the morning and taking a spin class.,i enjoy going to the gym early in the morning and taking a spin class,"['enjoy', 'going', 'gym', 'early', 'morning', 'taking', 'spin', 'class']","['enjoy', 'go', 'gym', 'earli', 'morn', 'take', 'spin', 'class']",enjoy go gym earli morn take spin class
when i born,when i born,['born'],['born'],born
I ate a delicious chocolate sundae.,i ate a delicious chocolate sundae,"['ate', 'delicious', 'chocolate', 'sundae']","['ate', 'delici', 'chocol', 'sunda']",ate delici chocol sunda
I bought a new Crepe Myrtle today.,i bought a new crepe myrtle today,"['bought', 'new', 'crepe', 'myrtle', 'today']","['bought', 'new', 'crepe', 'myrtl', 'today']",bought new crepe myrtl today
Early morning in the beach having breakfast with the family.,early morning in the beach having breakfast with the family,"['early', 'morning', 'beach', 'breakfast', 'family']","['earli', 'morn', 'beach', 'breakfast', 'famili']",earli morn beach breakfast famili
I came home from work and my dog licked my face and was happy to see me.,i came home from work and my dog licked my face and was happy to see me,"['came', 'home', 'work', 'dog', 'licked', 'face', 'happy', 'see']","['came', 'home', 'work', 'dog', 'lick', 'face', 'happi', 'see']",came home work dog lick face happi see
I got a new pet kitten.,i got a new pet kitten,"['got', 'new', 'pet', 'kitten']","['got', 'new', 'pet', 'kitten']",got new pet kitten
I travelled through public transport today.,i travelled through public transport today,"['travelled', 'public', 'transport', 'today']","['travel', 'public', 'transport', 'today']",travel public transport today
Walking out of the gym after a vigorous workout.,walking out of the gym after a vigorous workout,"['walking', 'gym', 'vigorous', 'workout']","['walk', 'gym', 'vigor', 'workout']",walk gym vigor workout
"Opening the front door in the middle of the day, just to feel the humid breeze coming in from the ocean",opening the front door in the middle of the day just to feel the humid breeze coming in from the ocean,"['opening', 'front', 'door', 'middle', 'day', 'feel', 'humid', 'breeze', 'coming', 'ocean']","['open', 'front', 'door', 'middl', 'day', 'feel', 'humid', 'breez', 'come', 'ocean']",open front door middl day feel humid breez come ocean
The day when i purchased halo 4 five days early to play for xbox.,the day when i purchased halo  five days early to play for xbox,"['day', 'purchased', 'halo', 'five', 'days', 'early', 'play', 'xbox']","['day', 'purchas', 'halo', 'five', 'day', 'earli', 'play', 'xbox']",day purchas halo five day earli play xbox
Me and my partner won our game of horseshoes against our opponents.,me and my partner won our game of horseshoes against our opponents,"['partner', 'game', 'horseshoes', 'opponents']","['partner', 'game', 'horsesho', 'oppon']",partner game horsesho oppon
I went for a bike ride in the early morning.,i went for a bike ride in the early morning,"['went', 'bike', 'ride', 'early', 'morning']","['went', 'bike', 'ride', 'earli', 'morn']",went bike ride earli morn
Today attended the meeting with confident. Achieved  all the targets. Got appreciation from the boss.,today attended the meeting with confident achieved  all the targets got appreciation from the boss,"['today', 'attended', 'meeting', 'confident', 'achieved', 'targets', 'got', 'appreciation', 'boss']","['today', 'attend', 'meet', 'confid', 'achiev', 'target', 'got', 'appreci', 'boss']",today attend meet confid achiev target got appreci boss
Early morning in Orlando. Walk out to the quiet lake to watch sunrise.,early morning in orlando walk out to the quiet lake to watch sunrise,"['early', 'morning', 'orlando', 'walk', 'quiet', 'lake', 'watch', 'sunrise']","['earli', 'morn', 'orlando', 'walk', 'quiet', 'lake', 'watch', 'sunris']",earli morn orlando walk quiet lake watch sunris
Have a good chance of getting this temp gig I found on Craigslist.,have a good chance of getting this temp gig i found on craigslist,"['good', 'chance', 'getting', 'temp', 'gig', 'found', 'craigslist']","['good', 'chanc', 'get', 'temp', 'gig', 'found', 'craigslist']",good chanc get temp gig found craigslist
I was sent home from work early today.,i was sent home from work early today,"['sent', 'home', 'work', 'early', 'today']","['sent', 'home', 'work', 'earli', 'today']",sent home work earli today
Speaking with my step dad yesterday.,speaking with my step dad yesterday,"['speaking', 'step', 'dad', 'yesterday']","['speak', 'step', 'dad', 'yesterday']",speak step dad yesterday
It is lunch time. I just got my order from a fried chicken take-out place. The chicken is crisp and savory. I enjoyed the time to myself while eating a delicious meal.,it is lunch time i just got my order from a fried chicken takeout place the chicken is crisp and savory i enjoyed the time to myself while eating a delicious meal,"['lunch', 'time', 'got', 'order', 'fried', 'chicken', 'takeout', 'place', 'chicken', 'crisp', 'savory', 'enjoyed', 'time', 'eating', 'delicious', 'meal']","['lunch', 'time', 'got', 'order', 'fri', 'chicken', 'takeout', 'place', 'chicken', 'crisp', 'savori', 'enjoy', 'time', 'eat', 'delici', 'meal']",lunch time got order fri chicken takeout place chicken crisp savori enjoy time eat delici meal
On the weekend I got to sleep in far past the time I usually wake up at during the week.,on the weekend i got to sleep in far past the time i usually wake up at during the week,"['weekend', 'got', 'sleep', 'far', 'past', 'time', 'usually', 'wake', 'week']","['weekend', 'got', 'sleep', 'far', 'past', 'time', 'usual', 'wake', 'week']",weekend got sleep far past time usual wake week
This morning I woke up to a cat laying on my belly and purring.,this morning i woke up to a cat laying on my belly and purring,"['morning', 'woke', 'cat', 'laying', 'belly', 'purring']","['morn', 'woke', 'cat', 'lay', 'belli', 'pur']",morn woke cat lay belli pur
My son woke up and came to cuddle with me.,my son woke up and came to cuddle with me,"['son', 'woke', 'came', 'cuddle']","['son', 'woke', 'came', 'cuddl']",son woke came cuddl
I went on a date with my wife tonight.,i went on a date with my wife tonight,"['went', 'date', 'wife', 'tonight']","['went', 'date', 'wife', 'tonight']",went date wife tonight
My cats came running to me when I got home.,my cats came running to me when i got home,"['cats', 'came', 'running', 'got', 'home']","['cat', 'came', 'run', 'got', 'home']",cat came run got home
"Today i have done 65 hits in mturk , highest by me in a single day till now,  so i am happy.",today i have done  hits in mturk  highest by me in a single day till now  so i am happy,"['today', 'done', 'hits', 'mturk', 'highest', 'single', 'day', 'till', 'happy']","['today', 'done', 'hit', 'mturk', 'highest', 'singl', 'day', 'till', 'happi']",today done hit mturk highest singl day till happi
Alone in my room in the morning listening to loud music.,alone in my room in the morning listening to loud music,"['alone', 'room', 'morning', 'listening', 'loud', 'music']","['alon', 'room', 'morn', 'listen', 'loud', 'music']",alon room morn listen loud music
This morning I hugged my wife and kissed her.,this morning i hugged my wife and kissed her,"['morning', 'hugged', 'wife', 'kissed']","['morn', 'hug', 'wife', 'kiss']",morn hug wife kiss
Got surprise FREE quad latte to start my morning.   Great start to the day!,got surprise free quad latte to start my morning   great start to the day,"['got', 'surprise', 'free', 'quad', 'latte', 'start', 'morning', 'great', 'start', 'day']","['got', 'surpris', 'free', 'quad', 'latt', 'start', 'morn', 'great', 'start', 'day']",got surpris free quad latt start morn great start day
I went to the dog park and watched the sweet puppies play.,i went to the dog park and watched the sweet puppies play,"['went', 'dog', 'park', 'watched', 'sweet', 'puppies', 'play']","['went', 'dog', 'park', 'watch', 'sweet', 'puppi', 'play']",went dog park watch sweet puppi play
Today my cute daughter perform dance for song.,today my cute daughter perform dance for song,"['today', 'cute', 'daughter', 'perform', 'dance', 'song']","['today', 'cute', 'daughter', 'perform', 'danc', 'song']",today cute daughter perform danc song
I had a lovely lunch with my mother.,i had a lovely lunch with my mother,"['lovely', 'lunch', 'mother']","['love', 'lunch', 'mother']",love lunch mother
I woke up this morning feeling energetic and refreshed.,i woke up this morning feeling energetic and refreshed,"['woke', 'morning', 'feeling', 'energetic', 'refreshed']","['woke', 'morn', 'feel', 'energet', 'refresh']",woke morn feel energet refresh
This morning I sleep untill 9.00am. I love that,this morning i sleep untill am i love that,"['morning', 'sleep', 'untill', 'love']","['morn', 'sleep', 'until', 'love']",morn sleep until love
"Got home after a long day of work. Sat down on the couch, opened a beer, turned on the TV to watch the game.",got home after a long day of work sat down on the couch opened a beer turned on the tv to watch the game,"['got', 'home', 'long', 'day', 'work', 'sat', 'couch', 'opened', 'beer', 'turned', 'tv', 'watch', 'game']","['got', 'home', 'long', 'day', 'work', 'sat', 'couch', 'open', 'beer', 'turn', 'tv', 'watch', 'game']",got home long day work sat couch open beer turn tv watch game
"Early morning in the library, very peaceful. The sun starting to come through the windows. The smell of books, feeling very enthusiastic to learn.",early morning in the library very peaceful the sun starting to come through the windows the smell of books feeling very enthusiastic to learn,"['early', 'morning', 'library', 'peaceful', 'sun', 'starting', 'come', 'windows', 'smell', 'books', 'feeling', 'enthusiastic', 'learn']","['earli', 'morn', 'librari', 'peac', 'sun', 'start', 'come', 'window', 'smell', 'book', 'feel', 'enthusiast', 'learn']",earli morn librari peac sun start come window smell book feel enthusiast learn
i cashed out Mturk money yesterday. for the first time.,i cashed out mturk money yesterday for the first time,"['cashed', 'mturk', 'money', 'yesterday', 'first', 'time']","['cash', 'mturk', 'money', 'yesterday', 'first', 'time']",cash mturk money yesterday first time
I found potatoes in the pantry.,i found potatoes in the pantry,"['found', 'potatoes', 'pantry']","['found', 'potato', 'pantri']",found potato pantri
"Finding out that work will be a little bit easier, Less load to crunch.",finding out that work will be a little bit easier less load to crunch,"['finding', 'work', 'little', 'bit', 'easier', 'less', 'load', 'crunch']","['find', 'work', 'littl', 'bit', 'easier', 'less', 'load', 'crunch']",find work littl bit easier less load crunch
I finally finished Harry Potter and the Cursed Child today and it was really good to get into reading again.,i finally finished harry potter and the cursed child today and it was really good to get into reading again,"['finally', 'finished', 'harry', 'potter', 'cursed', 'child', 'today', 'really', 'good', 'get', 'reading']","['final', 'finish', 'harri', 'potter', 'curs', 'child', 'today', 'realli', 'good', 'get', 'read']",final finish harri potter curs child today realli good get read
When my son Said loudly I farted in front family,when my son said loudly i farted in front family,"['son', 'said', 'loudly', 'farted', 'front', 'family']","['son', 'said', 'loudli', 'fart', 'front', 'famili']",son said loudli fart front famili
The weather was nice and I spent the day at the pool.  It was refreshing and relaxing.,the weather was nice and i spent the day at the pool  it was refreshing and relaxing,"['weather', 'nice', 'spent', 'day', 'pool', 'refreshing', 'relaxing']","['weather', 'nice', 'spent', 'day', 'pool', 'refresh', 'relax']",weather nice spent day pool refresh relax
The weather was cool enough that I could walk the dogs around the block.,the weather was cool enough that i could walk the dogs around the block,"['weather', 'cool', 'enough', 'could', 'walk', 'dogs', 'around', 'block']","['weather', 'cool', 'enough', 'could', 'walk', 'dog', 'around', 'block']",weather cool enough could walk dog around block
Hung out with friends last night. Had dinner and played games. So nice to see them.,hung out with friends last night had dinner and played games so nice to see them,"['hung', 'friends', 'last', 'night', 'dinner', 'played', 'games', 'nice', 'see']","['hung', 'friend', 'last', 'night', 'dinner', 'play', 'game', 'nice', 'see']",hung friend last night dinner play game nice see
I had so much fun at the zoo today with my family.,i had so much fun at the zoo today with my family,"['much', 'fun', 'zoo', 'today', 'family']","['much', 'fun', 'zoo', 'today', 'famili']",much fun zoo today famili
I was able to eat dinner with my girlfriend.,i was able to eat dinner with my girlfriend,"['able', 'eat', 'dinner', 'girlfriend']","['abl', 'eat', 'dinner', 'girlfriend']",abl eat dinner girlfriend
I kissed my girlfriend for the first time,i kissed my girlfriend for the first time,"['kissed', 'girlfriend', 'first', 'time']","['kiss', 'girlfriend', 'first', 'time']",kiss girlfriend first time
Today has been great! It was my birthday today and I got lots of presents.feeling happy..,today has been great it was my birthday today and i got lots of presentsfeeling happy,"['today', 'great', 'birthday', 'today', 'got', 'lots', 'presentsfeeling', 'happy']","['today', 'great', 'birthday', 'today', 'got', 'lot', 'presentsfeel', 'happi']",today great birthday today got lot presentsfeel happi
i meditated in the sun on one leg out on my deck this morning.  It was one of the only times of the day without my kids with me. Very recharging!,i meditated in the sun on one leg out on my deck this morning  it was one of the only times of the day without my kids with me very recharging,"['meditated', 'sun', 'one', 'leg', 'deck', 'morning', 'one', 'times', 'day', 'without', 'kids', 'recharging']","['medit', 'sun', 'one', 'leg', 'deck', 'morn', 'one', 'time', 'day', 'without', 'kid', 'recharg']",medit sun one leg deck morn one time day without kid recharg
The dogs and I saw the doe with her twin fawns this morning during our walk.,the dogs and i saw the doe with her twin fawns this morning during our walk,"['dogs', 'saw', 'doe', 'twin', 'fawns', 'morning', 'walk']","['dog', 'saw', 'doe', 'twin', 'fawn', 'morn', 'walk']",dog saw doe twin fawn morn walk
I light the candle next to my computer and start playing my daily-routine playlist.,i light the candle next to my computer and start playing my dailyroutine playlist,"['light', 'candle', 'next', 'computer', 'start', 'playing', 'dailyroutine', 'playlist']","['light', 'candl', 'next', 'comput', 'start', 'play', 'dailyroutin', 'playlist']",light candl next comput start play dailyroutin playlist
Today I found out I am getting a raise at work. Everyone was very excited for me. I will now be able to afford the apartment I want.,today i found out i am getting a raise at work everyone was very excited for me i will now be able to afford the apartment i want,"['today', 'found', 'getting', 'raise', 'work', 'everyone', 'excited', 'able', 'afford', 'apartment', 'want']","['today', 'found', 'get', 'rais', 'work', 'everyon', 'excit', 'abl', 'afford', 'apart', 'want']",today found get rais work everyon excit abl afford apart want
I woke up and couldn't stop looking at the beautiful sunny sky.,i woke up and couldnt stop looking at the beautiful sunny sky,"['woke', 'couldnt', 'stop', 'looking', 'beautiful', 'sunny', 'sky']","['woke', 'couldnt', 'stop', 'look', 'beauti', 'sunni', 'sky']",woke couldnt stop look beauti sunni sky
"Waking up and playing with the kittens, so warm and fuzzy.",waking up and playing with the kittens so warm and fuzzy,"['waking', 'playing', 'kittens', 'warm', 'fuzzy']","['wake', 'play', 'kitten', 'warm', 'fuzzi']",wake play kitten warm fuzzi
"Today successfuly i completed my first week of muscle building workout,reduced one kg,felt very happy.",today successfuly i completed my first week of muscle building workoutreduced one kgfelt very happy,"['today', 'successfuly', 'completed', 'first', 'week', 'muscle', 'building', 'workoutreduced', 'one', 'kgfelt', 'happy']","['today', 'successfuli', 'complet', 'first', 'week', 'muscl', 'build', 'workoutreduc', 'one', 'kgfelt', 'happi']",today successfuli complet first week muscl build workoutreduc one kgfelt happi
Jessica made me breakfast this morning. She is sooooo sweet.,jessica made me breakfast this morning she is sooooo sweet,"['jessica', 'made', 'breakfast', 'morning', 'sooooo', 'sweet']","['jessica', 'made', 'breakfast', 'morn', 'sooooo', 'sweet']",jessica made breakfast morn sooooo sweet
I had a happy moment when my son gave me a big hug before going into his school.,i had a happy moment when my son gave me a big hug before going into his school,"['happy', 'moment', 'son', 'gave', 'big', 'hug', 'going', 'school']","['happi', 'moment', 'son', 'gave', 'big', 'hug', 'go', 'school']",happi moment son gave big hug go school
"We stayed at the beach yesterday night, seeing the sun rising was just breathtaking.",we stayed at the beach yesterday night seeing the sun rising was just breathtaking,"['stayed', 'beach', 'yesterday', 'night', 'seeing', 'sun', 'rising', 'breathtaking']","['stay', 'beach', 'yesterday', 'night', 'see', 'sun', 'rise', 'breathtak']",stay beach yesterday night see sun rise breathtak
Packing for my vacation today brings much joy.,packing for my vacation today brings much joy,"['packing', 'vacation', 'today', 'brings', 'much', 'joy']","['pack', 'vacat', 'today', 'bring', 'much', 'joy']",pack vacat today bring much joy
"Early Cloudy Morning wake up too early to going the Temple , Because that's my birthday",early cloudy morning wake up too early to going the temple  because thats my birthday,"['early', 'cloudy', 'morning', 'wake', 'early', 'going', 'temple', 'thats', 'birthday']","['earli', 'cloudi', 'morn', 'wake', 'earli', 'go', 'templ', 'that', 'birthday']",earli cloudi morn wake earli go templ that birthday
Today after a long time I spent my time with my very close friend and felt very happy and jolly.,today after a long time i spent my time with my very close friend and felt very happy and jolly,"['today', 'long', 'time', 'spent', 'time', 'close', 'friend', 'felt', 'happy', 'jolly']","['today', 'long', 'time', 'spent', 'time', 'close', 'friend', 'felt', 'happi', 'jolli']",today long time spent time close friend felt happi jolli
I watched Simone win golf on floor last night.,i watched simone win golf on floor last night,"['watched', 'simone', 'win', 'golf', 'floor', 'last', 'night']","['watch', 'simon', 'win', 'golf', 'floor', 'last', 'night']",watch simon win golf floor last night
I played bingo with my son and my grandpa.,i played bingo with my son and my grandpa,"['played', 'bingo', 'son', 'grandpa']","['play', 'bingo', 'son', 'grandpa']",play bingo son grandpa
I got to sleep in today.,i got to sleep in today,"['got', 'sleep', 'today']","['got', 'sleep', 'today']",got sleep today
Jake,jake,['jake'],['jake'],jake
yesterday was a dose of vitamin sea. How lovely a midweek public holiday is!,yesterday was a dose of vitamin sea how lovely a midweek public holiday is,"['yesterday', 'dose', 'vitamin', 'sea', 'lovely', 'midweek', 'public', 'holiday']","['yesterday', 'dose', 'vitamin', 'sea', 'love', 'midweek', 'public', 'holiday']",yesterday dose vitamin sea love midweek public holiday
"My non-verbal Special-Needs little girl signed, """"I love you, MaMa,"""" and it filled me with joy!",my nonverbal specialneeds little girl signed i love you mama and it filled me with joy,"['nonverbal', 'specialneeds', 'little', 'girl', 'signed', 'love', 'mama', 'filled', 'joy']","['nonverb', 'specialne', 'littl', 'girl', 'sign', 'love', 'mama', 'fill', 'joy']",nonverb specialne littl girl sign love mama fill joy
"Me and My friends are going to outing today after a long time approximately 6 months, really happy",me and my friends are going to outing today after a long time approximately  months really happy,"['friends', 'going', 'outing', 'today', 'long', 'time', 'approximately', 'months', 'really', 'happy']","['friend', 'go', 'outing', 'today', 'long', 'time', 'approxim', 'month', 'realli', 'happi']",friend go outing today long time approxim month realli happi
"I woke up, had a cigarette and a cup of coffee. Shortly there after I went to the bathroom to have a bowl movement. It only took two wipes. the second just to make sure.",i woke up had a cigarette and a cup of coffee shortly there after i went to the bathroom to have a bowl movement it only took two wipes the second just to make sure,"['woke', 'cigarette', 'cup', 'coffee', 'shortly', 'went', 'bathroom', 'bowl', 'movement', 'took', 'two', 'wipes', 'second', 'make', 'sure']","['woke', 'cigarett', 'cup', 'coffe', 'shortli', 'went', 'bathroom', 'bowl', 'movement', 'took', 'two', 'wipe', 'second', 'make', 'sure']",woke cigarett cup coffe shortli went bathroom bowl movement took two wipe second make sure
"Today, I went to Water Park with all my classmates.",today i went to water park with all my classmates,"['today', 'went', 'water', 'park', 'classmates']","['today', 'went', 'water', 'park', 'classmat']",today went water park classmat
