text,cleaned_text,tokens,stemmed,processed_text
This morning I was able to drink an ice cold Coffiest for breakfast. It was very tasty.,this morning i was able to drink an ice cold coffiest for breakfast it was very tasty,"['morning', 'able', 'drink', 'ice', 'cold', 'coffiest', 'breakfast', 'tasty']","['morn', 'abl', 'drink', 'ice', 'cold', 'coffiest', 'breakfast', 'tasti']",morn abl drink ice cold coffiest breakfast tasti
Buy a new motorcycle.,buy a new motorcycle,"['buy', 'new', 'motorcycle']","['buy', 'new', 'motorcycl']",buy new motorcycl
family dinner,family dinner,"['family', 'dinner']","['famili', 'dinner']",famili dinner
"I found $10 on the sidewalk near work, felt lucky.",i found  on the sidewalk near work felt lucky,"['found', 'sidewalk', 'near', 'work', 'felt', 'lucky']","['found', 'sidewalk', 'near', 'work', 'felt', 'lucki']",found sidewalk near work felt lucki
"My husband pulled in the driveway at the end of the work day, I treasure the time we have together everyday.",my husband pulled in the driveway at the end of the work day i treasure the time we have together everyday,"['husband', 'pulled', 'driveway', 'end', 'work', 'day', 'treasure', 'time', 'together', 'everyday']","['husband', 'pull', 'driveway', 'end', 'work', 'day', 'treasur', 'time', 'togeth', 'everyday']",husband pull driveway end work day treasur time togeth everyday
Watched my daughter tenderly kiss my belly and tell her baby sister she loves her and wants her to come out and play.,watched my daughter tenderly kiss my belly and tell her baby sister she loves her and wants her to come out and play,"['watched', 'daughter', 'tenderly', 'kiss', 'belly', 'tell', 'baby', 'sister', 'loves', 'wants', 'come', 'play']","['watch', 'daughter', 'tenderli', 'kiss', 'belli', 'tell', 'babi', 'sister', 'love', 'want', 'come', 'play']",watch daughter tenderli kiss belli tell babi sister love want come play
An older couple at the restaurant complimented my wife and I on how engaged in conversation. It was refreshing for them to see.,an older couple at the restaurant complimented my wife and i on how engaged in conversation it was refreshing for them to see,"['older', 'couple', 'restaurant', 'complimented', 'wife', 'engaged', 'conversation', 'refreshing', 'see']","['older', 'coupl', 'restaur', 'compliment', 'wife', 'engag', 'convers', 'refresh', 'see']",older coupl restaur compliment wife engag convers refresh see
"Today my wife my daughter and me went to eat at a local restaurant, then we went to the movies, new film on broadcast. such nice moments, all relaxed.",today my wife my daughter and me went to eat at a local restaurant then we went to the movies new film on broadcast such nice moments all relaxed,"['today', 'wife', 'daughter', 'went', 'eat', 'local', 'restaurant', 'went', 'movies', 'new', 'film', 'broadcast', 'nice', 'moments', 'relaxed']","['today', 'wife', 'daughter', 'went', 'eat', 'local', 'restaur', 'went', 'movi', 'new', 'film', 'broadcast', 'nice', 'moment', 'relax']",today wife daughter went eat local restaur went movi new film broadcast nice moment relax
"For lunch, I had a yummy cheeseburger. It was so good.",for lunch i had a yummy cheeseburger it was so good,"['lunch', 'yummy', 'cheeseburger', 'good']","['lunch', 'yummi', 'cheeseburg', 'good']",lunch yummi cheeseburg good
I left work yesterday smiling as I got two good reviews on my phone sales calls,i left work yesterday smiling as i got two good reviews on my phone sales calls,"['left', 'work', 'yesterday', 'smiling', 'got', 'two', 'good', 'reviews', 'phone', 'sales', 'calls']","['left', 'work', 'yesterday', 'smile', 'got', 'two', 'good', 'review', 'phone', 'sale', 'call']",left work yesterday smile got two good review phone sale call
Finally got some much needed organizing done!,finally got some much needed organizing done,"['finally', 'got', 'much', 'needed', 'organizing', 'done']","['final', 'got', 'much', 'need', 'organ', 'done']",final got much need organ done
my happiest moment is when i heard news that i am going to be daddy.,my happiest moment is when i heard news that i am going to be daddy,"['happiest', 'moment', 'heard', 'news', 'going', 'daddy']","['happiest', 'moment', 'heard', 'news', 'go', 'daddi']",happiest moment heard news go daddi
That feeling when I turn down my street after a hard day at work.,that feeling when i turn down my street after a hard day at work,"['feeling', 'turn', 'street', 'hard', 'day', 'work']","['feel', 'turn', 'street', 'hard', 'day', 'work']",feel turn street hard day work
"Such a beautiful, clear morning when I left the station today!",such a beautiful clear morning when i left the station today,"['beautiful', 'clear', 'morning', 'left', 'station', 'today']","['beauti', 'clear', 'morn', 'left', 'station', 'today']",beauti clear morn left station today
I got to spend time with my awesome niece today!,i got to spend time with my awesome niece today,"['got', 'spend', 'time', 'awesome', 'niece', 'today']","['got', 'spend', 'time', 'awesom', 'niec', 'today']",got spend time awesom niec today
The last bite of the chocolote cherry ice cream was all mine. All mine. It's like a relationship is ending and yet you can start on another one later.,the last bite of the chocolote cherry ice cream was all mine all mine its like a relationship is ending and yet you can start on another one later,"['last', 'bite', 'chocolote', 'cherry', 'ice', 'cream', 'mine', 'mine', 'like', 'relationship', 'ending', 'yet', 'start', 'another', 'one', 'later']","['last', 'bite', 'chocolot', 'cherri', 'ice', 'cream', 'mine', 'mine', 'like', 'relationship', 'end', 'yet', 'start', 'anoth', 'one', 'later']",last bite chocolot cherri ice cream mine mine like relationship end yet start anoth one later
Not very many people at the gym today.  I had most of the equipment I needed to myself!,not very many people at the gym today  i had most of the equipment i needed to myself,"['many', 'people', 'gym', 'today', 'equipment', 'needed']","['mani', 'peopl', 'gym', 'today', 'equip', 'need']",mani peopl gym today equip need
I was able to get a raise at work today,i was able to get a raise at work today,"['able', 'get', 'raise', 'work', 'today']","['abl', 'get', 'rais', 'work', 'today']",abl get rais work today
Finally fulled moved into our new house today.,finally fulled moved into our new house today,"['finally', 'fulled', 'moved', 'new', 'house', 'today']","['final', 'full', 'move', 'new', 'hous', 'today']",final full move new hous today
"Yesterday, a friend i had not spoken to in years called me out of the blue. We had a great conversation.",yesterday a friend i had not spoken to in years called me out of the blue we had a great conversation,"['yesterday', 'friend', 'spoken', 'years', 'called', 'blue', 'great', 'conversation']","['yesterday', 'friend', 'spoken', 'year', 'call', 'blue', 'great', 'convers']",yesterday friend spoken year call blue great convers
"Today, I did stayed home all day and played video games.",today i did stayed home all day and played video games,"['today', 'stayed', 'home', 'day', 'played', 'video', 'games']","['today', 'stay', 'home', 'day', 'play', 'video', 'game']",today stay home day play video game
"The day my husband and I got married was one of the most joyous occasions in my life, next to having our beautiful daughter.",the day my husband and i got married was one of the most joyous occasions in my life next to having our beautiful daughter,"['day', 'husband', 'got', 'married', 'one', 'joyous', 'occasions', 'life', 'next', 'beautiful', 'daughter']","['day', 'husband', 'got', 'marri', 'one', 'joyou', 'occas', 'life', 'next', 'beauti', 'daughter']",day husband got marri one joyou occas life next beauti daughter
"When am alone in the office, it quiet and peaceful.",when am alone in the office it quiet and peaceful,"['alone', 'office', 'quiet', 'peaceful']","['alon', 'offic', 'quiet', 'peac']",alon offic quiet peac
I was so happy when i haf the chance to meet my favorite rapper plies in july of 2011 and that wasnt the only time i did hang with him but that was a moment for life,i was so happy when i haf the chance to meet my favorite rapper plies in july of  and that wasnt the only time i did hang with him but that was a moment for life,"['happy', 'haf', 'chance', 'meet', 'favorite', 'rapper', 'plies', 'july', 'wasnt', 'time', 'hang', 'moment', 'life']","['happi', 'haf', 'chanc', 'meet', 'favorit', 'rapper', 'pli', 'juli', 'wasnt', 'time', 'hang', 'moment', 'life']",happi haf chanc meet favorit rapper pli juli wasnt time hang moment life
I go to the gym and feel a bit better about taking care of myself.,i go to the gym and feel a bit better about taking care of myself,"['go', 'gym', 'feel', 'bit', 'better', 'taking', 'care']","['go', 'gym', 'feel', 'bit', 'better', 'take', 'care']",go gym feel bit better take care
Picked up my son from a sleepover.  He said that he loves me more than any of those people he was with.,picked up my son from a sleepover  he said that he loves me more than any of those people he was with,"['picked', 'son', 'sleepover', 'said', 'loves', 'people']","['pick', 'son', 'sleepov', 'said', 'love', 'peopl']",pick son sleepov said love peopl
I found a free Sherlock Holmes collection on Amazon.,i found a free sherlock holmes collection on amazon,"['found', 'free', 'sherlock', 'holmes', 'collection', 'amazon']","['found', 'free', 'sherlock', 'holm', 'collect', 'amazon']",found free sherlock holm collect amazon
"My dog woke me up this morning, he was very energetic and happy to see me.",my dog woke me up this morning he was very energetic and happy to see me,"['dog', 'woke', 'morning', 'energetic', 'happy', 'see']","['dog', 'woke', 'morn', 'energet', 'happi', 'see']",dog woke morn energet happi see
My basketball league team won its game yesterday. it was a hard fought battle but I relished and was overjoyed by our victory over our competitors.,my basketball league team won its game yesterday it was a hard fought battle but i relished and was overjoyed by our victory over our competitors,"['basketball', 'league', 'team', 'game', 'yesterday', 'hard', 'fought', 'battle', 'relished', 'overjoyed', 'victory', 'competitors']","['basketbal', 'leagu', 'team', 'game', 'yesterday', 'hard', 'fought', 'battl', 'relish', 'overjoy', 'victori', 'competitor']",basketbal leagu team game yesterday hard fought battl relish overjoy victori competitor
Yesterday I met my old friend after two years.,yesterday i met my old friend after two years,"['yesterday', 'met', 'old', 'friend', 'two', 'years']","['yesterday', 'met', 'old', 'friend', 'two', 'year']",yesterday met old friend two year
I finally finished making my quilt.,i finally finished making my quilt,"['finally', 'finished', 'making', 'quilt']","['final', 'finish', 'make', 'quilt']",final finish make quilt
I ate pizza today.,i ate pizza today,"['ate', 'pizza', 'today']","['ate', 'pizza', 'today']",ate pizza today
I was able to pay off some debt.  It was like a huge weight was lifted off my shoulders.,i was able to pay off some debt  it was like a huge weight was lifted off my shoulders,"['able', 'pay', 'debt', 'like', 'huge', 'weight', 'lifted', 'shoulders']","['abl', 'pay', 'debt', 'like', 'huge', 'weight', 'lift', 'shoulder']",abl pay debt like huge weight lift shoulder
I went to play squash after a long time with my friend.,i went to play squash after a long time with my friend,"['went', 'play', 'squash', 'long', 'time', 'friend']","['went', 'play', 'squash', 'long', 'time', 'friend']",went play squash long time friend
My son called just to say I love you.,my son called just to say i love you,"['son', 'called', 'say', 'love']","['son', 'call', 'say', 'love']",son call say love
Spending time with my family. I love being with my children.,spending time with my family i love being with my children,"['spending', 'time', 'family', 'love', 'children']","['spend', 'time', 'famili', 'love', 'children']",spend time famili love children
I woke up early this morning and I meditated before going to class.,i woke up early this morning and i meditated before going to class,"['woke', 'early', 'morning', 'meditated', 'going', 'class']","['woke', 'earli', 'morn', 'medit', 'go', 'class']",woke earli morn medit go class
"Yesterday, I was playing Pokemon Go and I put my Dragonite in a gym. Almost 24 hours later, my Dragonite is still there.",yesterday i was playing pokemon go and i put my dragonite in a gym almost  hours later my dragonite is still there,"['yesterday', 'playing', 'pokemon', 'go', 'put', 'dragonite', 'gym', 'almost', 'hours', 'later', 'dragonite', 'still']","['yesterday', 'play', 'pokemon', 'go', 'put', 'dragonit', 'gym', 'almost', 'hour', 'later', 'dragonit', 'still']",yesterday play pokemon go put dragonit gym almost hour later dragonit still
I realised when I got into work that I didn't have as much to do as I thought.,i realised when i got into work that i didnt have as much to do as i thought,"['realised', 'got', 'work', 'didnt', 'much', 'thought']","['realis', 'got', 'work', 'didnt', 'much', 'thought']",realis got work didnt much thought
Sipping hot coffee in the morning.,sipping hot coffee in the morning,"['sipping', 'hot', 'coffee', 'morning']","['sip', 'hot', 'coffe', 'morn']",sip hot coffe morn
I went to the community pool and had it to myself.,i went to the community pool and had it to myself,"['went', 'community', 'pool']","['went', 'commun', 'pool']",went commun pool
Visiting with my kids after school.,visiting with my kids after school,"['visiting', 'kids', 'school']","['visit', 'kid', 'school']",visit kid school
"Harvested a huge batch of peppers from the garden to prep and freeze. Felt industrious and worthwhile, taking care of and respecting the earth.",harvested a huge batch of peppers from the garden to prep and freeze felt industrious and worthwhile taking care of and respecting the earth,"['harvested', 'huge', 'batch', 'peppers', 'garden', 'prep', 'freeze', 'felt', 'industrious', 'worthwhile', 'taking', 'care', 'respecting', 'earth']","['harvest', 'huge', 'batch', 'pepper', 'garden', 'prep', 'freez', 'felt', 'industri', 'worthwhil', 'take', 'care', 'respect', 'earth']",harvest huge batch pepper garden prep freez felt industri worthwhil take care respect earth
"After my workout, I exhaled with confidence in knowing I gave it all I had.",after my workout i exhaled with confidence in knowing i gave it all i had,"['workout', 'exhaled', 'confidence', 'knowing', 'gave']","['workout', 'exhal', 'confid', 'know', 'gave']",workout exhal confid know gave
Last night I met some wonderful people.,last night i met some wonderful people,"['last', 'night', 'met', 'wonderful', 'people']","['last', 'night', 'met', 'wonder', 'peopl']",last night met wonder peopl
My sweet little girls jumped right out of bed for the first day of school!,my sweet little girls jumped right out of bed for the first day of school,"['sweet', 'little', 'girls', 'jumped', 'right', 'bed', 'first', 'day', 'school']","['sweet', 'littl', 'girl', 'jump', 'right', 'bed', 'first', 'day', 'school']",sweet littl girl jump right bed first day school
Completed reading a three thousand page novel on my iPad! Joyful! Now I can move on to the next one.,completed reading a three thousand page novel on my ipad joyful now i can move on to the next one,"['completed', 'reading', 'three', 'thousand', 'page', 'novel', 'ipad', 'joyful', 'move', 'next', 'one']","['complet', 'read', 'three', 'thousand', 'page', 'novel', 'ipad', 'joy', 'move', 'next', 'one']",complet read three thousand page novel ipad joy move next one
"A butterfly flew around me in the garden, it was really pretty.",a butterfly flew around me in the garden it was really pretty,"['butterfly', 'flew', 'around', 'garden', 'really', 'pretty']","['butterfli', 'flew', 'around', 'garden', 'realli', 'pretti']",butterfli flew around garden realli pretti
At night time I cook dinner and drink alcohol.,at night time i cook dinner and drink alcohol,"['night', 'time', 'cook', 'dinner', 'drink', 'alcohol']","['night', 'time', 'cook', 'dinner', 'drink', 'alcohol']",night time cook dinner drink alcohol
Meeting my best friend after a long time.,meeting my best friend after a long time,"['meeting', 'best', 'friend', 'long', 'time']","['meet', 'best', 'friend', 'long', 'time']",meet best friend long time
Got a new friend in GYM yesterday who was so nice.,got a new friend in gym yesterday who was so nice,"['got', 'new', 'friend', 'gym', 'yesterday', 'nice']","['got', 'new', 'friend', 'gym', 'yesterday', 'nice']",got new friend gym yesterday nice
Having campfires on the beach.,having campfires on the beach,"['campfires', 'beach']","['campfir', 'beach']",campfir beach
I went out with my girlfriend to see a movie.,i went out with my girlfriend to see a movie,"['went', 'girlfriend', 'see', 'movie']","['went', 'girlfriend', 'see', 'movi']",went girlfriend see movi
Work went smooth and easy today without any hassles.,work went smooth and easy today without any hassles,"['work', 'went', 'smooth', 'easy', 'today', 'without', 'hassles']","['work', 'went', 'smooth', 'easi', 'today', 'without', 'hassl']",work went smooth easi today without hassl
My sister came over for a girls night.,my sister came over for a girls night,"['sister', 'came', 'girls', 'night']","['sister', 'came', 'girl', 'night']",sister came girl night
I got a new job working as a teacher.,i got a new job working as a teacher,"['got', 'new', 'job', 'working', 'teacher']","['got', 'new', 'job', 'work', 'teacher']",got new job work teacher
I really happy when i got lip kiss to my wife.,i really happy when i got lip kiss to my wife,"['really', 'happy', 'got', 'lip', 'kiss', 'wife']","['realli', 'happi', 'got', 'lip', 'kiss', 'wife']",realli happi got lip kiss wife
my wife surprised me with a little gift for our aniversary,my wife surprised me with a little gift for our aniversary,"['wife', 'surprised', 'little', 'gift', 'aniversary']","['wife', 'surpris', 'littl', 'gift', 'aniversari']",wife surpris littl gift aniversari
I started working out recently and was finally able to achieve a personal goal of mine: I was able to bike for 30 minutes straight without any rest.,i started working out recently and was finally able to achieve a personal goal of mine i was able to bike for  minutes straight without any rest,"['started', 'working', 'recently', 'finally', 'able', 'achieve', 'personal', 'goal', 'mine', 'able', 'bike', 'minutes', 'straight', 'without', 'rest']","['start', 'work', 'recent', 'final', 'abl', 'achiev', 'person', 'goal', 'mine', 'abl', 'bike', 'minut', 'straight', 'without', 'rest']",start work recent final abl achiev person goal mine abl bike minut straight without rest
I found out that my sister is going to have a baby!,i found out that my sister is going to have a baby,"['found', 'sister', 'going', 'baby']","['found', 'sister', 'go', 'babi']",found sister go babi
Went swimming in a friend's mom's pool on an incredibly hot day.,went swimming in a friends moms pool on an incredibly hot day,"['went', 'swimming', 'friends', 'moms', 'pool', 'incredibly', 'hot', 'day']","['went', 'swim', 'friend', 'mom', 'pool', 'incred', 'hot', 'day']",went swim friend mom pool incred hot day
I woke up early this morning and got to see the sun rise and the birds started chirping. It was peaceful.,i woke up early this morning and got to see the sun rise and the birds started chirping it was peaceful,"['woke', 'early', 'morning', 'got', 'see', 'sun', 'rise', 'birds', 'started', 'chirping', 'peaceful']","['woke', 'earli', 'morn', 'got', 'see', 'sun', 'rise', 'bird', 'start', 'chirp', 'peac']",woke earli morn got see sun rise bird start chirp peac
I played fetch with my dog and her excitement was contagious. She was running and jumping all over the apartment.,i played fetch with my dog and her excitement was contagious she was running and jumping all over the apartment,"['played', 'fetch', 'dog', 'excitement', 'contagious', 'running', 'jumping', 'apartment']","['play', 'fetch', 'dog', 'excit', 'contagi', 'run', 'jump', 'apart']",play fetch dog excit contagi run jump apart
At the rainy time will see the rain falls,at the rainy time will see the rain falls,"['rainy', 'time', 'see', 'rain', 'falls']","['raini', 'time', 'see', 'rain', 'fall']",raini time see rain fall
"My coffee, my wife, my daughter, the best part of my day.",my coffee my wife my daughter the best part of my day,"['coffee', 'wife', 'daughter', 'best', 'part', 'day']","['coffe', 'wife', 'daughter', 'best', 'part', 'day']",coffe wife daughter best part day
I got a high score on my favorite game.,i got a high score on my favorite game,"['got', 'high', 'score', 'favorite', 'game']","['got', 'high', 'score', 'favorit', 'game']",got high score favorit game
I am cooking supper for my family.,i am cooking supper for my family,"['cooking', 'supper', 'family']","['cook', 'supper', 'famili']",cook supper famili
I went canoeing with my girlfriend.,i went canoeing with my girlfriend,"['went', 'canoeing', 'girlfriend']","['went', 'cano', 'girlfriend']",went cano girlfriend
"Listening to music out loud, singing the songs.",listening to music out loud singing the songs,"['listening', 'music', 'loud', 'singing', 'songs']","['listen', 'music', 'loud', 'sing', 'song']",listen music loud sing song
Even though yesterday was a hard day of work we got to eat dinner at my favorite place and that's always a good thing.,even though yesterday was a hard day of work we got to eat dinner at my favorite place and thats always a good thing,"['even', 'though', 'yesterday', 'hard', 'day', 'work', 'got', 'eat', 'dinner', 'favorite', 'place', 'thats', 'always', 'good', 'thing']","['even', 'though', 'yesterday', 'hard', 'day', 'work', 'got', 'eat', 'dinner', 'favorit', 'place', 'that', 'alway', 'good', 'thing']",even though yesterday hard day work got eat dinner favorit place that alway good thing
The overcast day that had break a too hot week. Filling droplets of water in my skin.,the overcast day that had break a too hot week filling droplets of water in my skin,"['overcast', 'day', 'break', 'hot', 'week', 'filling', 'droplets', 'water', 'skin']","['overcast', 'day', 'break', 'hot', 'week', 'fill', 'droplet', 'water', 'skin']",overcast day break hot week fill droplet water skin
I had a delicious salad for lunch that was very filling and tasted great.,i had a delicious salad for lunch that was very filling and tasted great,"['delicious', 'salad', 'lunch', 'filling', 'tasted', 'great']","['delici', 'salad', 'lunch', 'fill', 'tast', 'great']",delici salad lunch fill tast great
I was happy again today 3:00 p.m. when more hits on mturk were posted that i like to work on and i got 10 of those hits completed.,i was happy again today  pm when more hits on mturk were posted that i like to work on and i got  of those hits completed,"['happy', 'today', 'pm', 'hits', 'mturk', 'posted', 'like', 'work', 'got', 'hits', 'completed']","['happi', 'today', 'pm', 'hit', 'mturk', 'post', 'like', 'work', 'got', 'hit', 'complet']",happi today pm hit mturk post like work got hit complet
I went in a date with a person I really like.,i went in a date with a person i really like,"['went', 'date', 'person', 'really', 'like']","['went', 'date', 'person', 'realli', 'like']",went date person realli like
Today I witness the miracle of birth.,today i witness the miracle of birth,"['today', 'witness', 'miracle', 'birth']","['today', 'wit', 'miracl', 'birth']",today wit miracl birth
aargh i remember when i pass my high school exams with good grades my parents are so happy and the proud on thier fae for me make my whole day beautiful,aargh i remember when i pass my high school exams with good grades my parents are so happy and the proud on thier fae for me make my whole day beautiful,"['aargh', 'remember', 'pass', 'high', 'school', 'exams', 'good', 'grades', 'parents', 'happy', 'proud', 'thier', 'fae', 'make', 'whole', 'day', 'beautiful']","['aargh', 'rememb', 'pass', 'high', 'school', 'exam', 'good', 'grade', 'parent', 'happi', 'proud', 'thier', 'fae', 'make', 'whole', 'day', 'beauti']",aargh rememb pass high school exam good grade parent happi proud thier fae make whole day beauti
I love when my bulldog lays on my lap.,i love when my bulldog lays on my lap,"['love', 'bulldog', 'lays', 'lap']","['love', 'bulldog', 'lay', 'lap']",love bulldog lay lap
I found out my wife was pregnant,i found out my wife was pregnant,"['found', 'wife', 'pregnant']","['found', 'wife', 'pregnant']",found wife pregnant
I reached office on time.it happens once in a while. i felt proud and happy today.,i reached office on timeit happens once in a while i felt proud and happy today,"['reached', 'office', 'timeit', 'happens', 'felt', 'proud', 'happy', 'today']","['reach', 'offic', 'timeit', 'happen', 'felt', 'proud', 'happi', 'today']",reach offic timeit happen felt proud happi today
Riding my bicycle on the trail putting in 10 miles non stop.,riding my bicycle on the trail putting in  miles non stop,"['riding', 'bicycle', 'trail', 'putting', 'miles', 'non', 'stop']","['ride', 'bicycl', 'trail', 'put', 'mile', 'non', 'stop']",ride bicycl trail put mile non stop
I went to my favorite cafe during lunch,i went to my favorite cafe during lunch,"['went', 'favorite', 'cafe', 'lunch']","['went', 'favorit', 'cafe', 'lunch']",went favorit cafe lunch
"I went swimming today, it was a lot of fun.",i went swimming today it was a lot of fun,"['went', 'swimming', 'today', 'lot', 'fun']","['went', 'swim', 'today', 'lot', 'fun']",went swim today lot fun
Purchased a new book from a favorite author today,purchased a new book from a favorite author today,"['purchased', 'new', 'book', 'favorite', 'author', 'today']","['purchas', 'new', 'book', 'favorit', 'author', 'today']",purchas new book favorit author today
